cidade;denominacao_do_bem_tombado;endereco;tipo;ano_de_tombamento
Pedro Teixeira;Igreja de Nossa Senhora de Lourdes;;BI;
Pedro Teixeira;Ponte Nova;;BI;
Pedro Teixeira;Oratório;;BM;
Pedro Teixeira;Ostensório;;BM;
Pequeri;Imagem de São Pedro;Casa Paroquial da Matriz de São Pedro de Pequeri;BM;2013
Pequeri;Antiga Estação Ferroviária;;BI;
Pequeri;Balneário Municipal;;CP;
Pequi;Capela de Nossa Senhora do Rosário;Praça do Rosário - Centro;BI;2025
Pequi;Cruzeiro do Ponto Chic -Cruzeiro de Padre Libério;Alto da Serra do Rio do Peixe - Ponto Chique;BM;2025
Perdizes;Conjunto Urbano e Paisagístico Praça Maria Joaquina do Espírito Santo;Praça Maria Joaquina do Espírito Santo - Distrito de São José de Antinha;CP;2024
Perdizes;Igreja Matriz Nossa Senhora da Conceição;;BI;2008
Perdizes;Imagem de São Sebastião;;BM;2008
Perdões;Imagem do Senhor Bom Jesus de Perdões;Altar-Mor da Igreja Matriz Senhor Bom Jesus;BM;2004
Perdões;Praça José Modesto Sobrinho;Ruas Maximiliano Modesto Pereira - Marina Pinheiro - Doutor José Jorge - Rua do Rosário - Saudade;CP;2004
Perdões;Praça Zoroastro Alvarenga;;CP;2004
Perdões;Obelisco da Praça 1º de Junho – Monumento em Homenagem ao ex-Combatente 2ª Guerra;Praça 1º de Julho - Centro;BI;2004
Perdões;Estação Ferroviária - Atual Casa de Cultura;Praça Fernando de Oliveira nº 98;BI;2004
Perdões;Igreja Nossa Senhora do Rosário;Praça José Modesto Sobrinho s/nº;BI;2004
Perdões;1ª Prefeitura de Perdões – Atual Biblioteca;Praça Manoel Domingues de Sá Fortes 04;BI;2004
Perdões;Santa Casa de Misericórdia;Praça Otávio Alvarenga nº 48;BI;2004
Perdões;Igreja Matriz Senhor Bom Jesus dos Perdões;Praça Zoroastro Alvarenga s/nº;BI;2004
Perdões;Grupo Escolar Otaviano Alvarenga;Rua Coronel Joaquim Francicsco nº 38;BI;2004
Perdões;1º Fórum de Perdões – atual Museu e Estação de Rádio;Rua Sá Fortes nº 55;BI;2004
Perdões;Casa Paroquial;;BI;
Periquito;Capela de São Sebastião;Rua da Igreja, s/n°  - Centro;BI;
Piau;Pintura Parietal;Prefeitura Municipal - Rua Silva Jardim  nº 67 - Centro;BM;2012
Piau;Prefeitura Municipal de Piau;Rua Silva Jardim nº 67 - Centro;BI;2023
Piau;Busto de Joaquim Marciano Loures;;BI;2004
Piedade de Caratinga;Imagem de Nossa Senhora da Piedade;;BM;2012
Piedade de Caratinga;Conjunto Paisagístico da Praça Adriano Sabino;;CP;2014
Piedade de Ponte Nova;Escola Estadual Coronel Antoninho;;BI;2003
Piedade de Ponte Nova;Imagem de Nossa Senhora Piedade;;BM;2003
Piedade de Ponte Nova;Parque Municipal de Piedade;;CP;2004
Piedade do Rio Grande;Núcleo Histórico de Santo Antônio do Porto;Distrito de Santo Antônio do Porto - Estrada sentido à Santana do Garambéu;NH;2019
Piedade do Rio Grande;Igreja do Rosário - Antiga Igreja Nossa Senhora da Piedade;Praça Salvador Lourenço s/nº- Centro;BI;
Piedade do Rio Grande;Imagem de Nossa Senhora da Piedade;Igreja Matriz de Nossa Senhora da Piedade;BM;
Piedade do Rio Grande;Imagem de Nossa Senhora do Rosário;Praça Salvador Lourenço s/nº;BM;2012
Piedade do Rio Grande;Conjunto Paisagístico de Santo Antônio do Porto;;CP;
Piedade dos Gerais;Fazenda do Andrade - Sede;Comunidade de Cambuí;BI;2006
Piedade dos Gerais;Fazenda Grota dos Pinheiros - Sede;Comunidade de Egito;BI;2006
Piedade dos Gerais;Fazenda Retiro A;Comunidade Retiro;BI;2006
Piedade dos Gerais;Fazenda Mata Boi;Povoado Casa Branca;BI;2007
Piedade dos Gerais;Fazenda Macaúbas - Sede;Povoado de Macaúbas;BI;2006
Piedade dos Gerais;Ruínas da Capela de Nossa Senhora do Rosário;Rua Nossa Senhora do Bonfim  nº 872 - Centro;BI;2003
Piedade dos Gerais;Instrumentos da Corporação Musical de Piedade das Gerais;Rua Presidente Vargas  nº 35 - Centro;BM;2003
Piedade dos Gerais;Matriz de Nossa Senhora da Piedade;;BI;
Piedade dos Gerais;Fazenda Retiro B: Sede;;BI;2006
Piedade dos Gerais;Cachoeira do Encontro;;CP;2006
Piedade dos Gerais;Cachoeira do Vento;;CP;2006
Piedade dos Gerais;Cachoeira dos Pássaros;;CP;2006
Pimenta;Conjunto Paisagístico e Centro Histórico de Pimenta;Praça Padre Espíndola, Antiga Prefeitura, Galpão Cultural, Antigos Fornos de Cal e Lagoa Copacabana;CP;2025
Pimenta;Antiga Casa Distribuidora -  Atual Casa do Turista de Pimenta;Avenida Jair Leite nº37 - Centro;BI;2022
Pimenta;Acervo de Livros Históricos do Século XX;Prefeitura Municipal;BM;2021
Pingo D'Agua;APA Pingo D’Agua;E 767.889,71 e n° 7.818.851,53;CP;
Pingo D'Agua;Imagem Sacra de São Sebastião - Padroeiro da Cidade;Igreja Matriz de São Sebastião - Rua Creuza Ferreira Duarte nº50 - Bairro São Sebastião;BM;2025
Pintópolis;Imagem de São José;Comunidade Alegre - Capela de São José;BM;
Piracema;Conjunto Paisagístico Praça José Ribeiro de Assis;Praça José Ribeiro de Assis;CP;2006
Piracema;Imagem de Nossa Senhora das Necessidades;Igreja Matriz de Nossa Senhora das Necessidades - Praça Manoel Sampaio s/nº- Centro;BM;2013
Pirajuba;Capela Santa Terezinha;;BI;2009
Piranga;Núcleo Histórico e Urbano de Pinheiros Altos;Distrito de Pinheiros Altos;NH;2011
Piranga;Núcleo Histórico Urbanístico de Santo Antônio do Pirapetinga;Distrito de Santo Antônio do Pirapetinga;NH;2007
Piranga;Conjunto Natural e Paisagístico da Fazenda Praia Grande;Fazenda Praia Grande - Distrito de Pinheiros Altos;CP;2012
Piranga;Câmara Municipal;Praça Coronel Amarantino nº 10 - Centro;BI;2012
Piranga;Igreja Nossa Senhora da Conceição;Praça Nossa Senhora da Conceição s/nº - Povoado de Pinheiros Altos;BI;2008
Piranga;Igreja Nossa Senhora do Rosário;Praça Nossa Senhora do Rosário s/nº - Distrito de Pinheiros Altos;BI;2008
Piranga;Prefeitura Municipal;Rua Benedito Valadares nº 09 - Centro;BI;2012
Piranga;Casarão do Rosário;Rua José Chassin s/nº;BI;2007
Piranga;Igreja Nossa Senhora da Boa Morte;Rua Vereadora Maria Anselma, s/nº - Centro;BI;2009
Piranga;Imagem do Senhor Bom Jesus do Matozinhos;Santuário do Senhor Bom Jesus do Matozinhos s/nº -  Distrito de Santo Antônio do Pirapetinga;BM;2007
Piranguçu;Edificação;Rua José Maria da Silveira Campos nº 116  - Centro;BI;2025
Piranguçu;Imagens de Nossa Senhora de Lourdes e de Santa Bernadete;Gruta de Nossa Senhora de Lourdes e Santa Bernadete - Rua Inácio Leme s/nº - Centro;BM;2025
Piranguçu;"Praça Primeiro de Março: elementos arquitetônicos, urbanísticos e paisagísticos, estruturas, vegetação,   bancos de concreto, placas de aviso, lixeiras e postes de iluminação; fonte d’água, deque de madeira; quiosque de madeira e trabalhos artísticos em mosaicos de cacos cerâmicos";"latitude 22°31'34.22""S e longitude 45°29'46.99""O";CP;2026
Piranguinho;Ginásio Poliesportivo João José dos Reis - Reizão;Rua Gregório Mota s/nº;BI;2025
Piranguinho;Estação Ferroviária;Avenida Sebastião Pereira Machado s/nº;BI;2021
Piranguinho;Ponte Governador Valadares;Rua Flauzina da Costa s/n° - Distrito de Olegário Maciel;BI;2022
Piranguinho;Paço Municipal;Avenida Alferes Renó nº 200 - Centro;BI;2024
Piranguinho;Imagem de São Benedito;Igreja Matriz de Santa Isabel - Praça Coronel Braz;BM;2024
Piranguinho;Capela Nossa Senhora do Carmo;Capote;BI;2009
Piranguinho;Estação Ferroviária de Olegário Maciel;;BI;2007
Piranguinho;Ponte de Ferro sobre o Rio Sapucaí;;BI;2003
Piranguinho;Imagem de Santa Isabel de Portugal;;BM;2003
Piranguinho;Conjunto Paisagístico da Mata do Cruzeiro;;CP;2010
Pirapetinga;Praça Santana;Ruas José Ferreira de Souza - Hamilton Martins e Bento Martins;BI;2025
Pirapetinga;Plataforma Parada Doutor Junqueira;Estrada Rural da Parada;BI;2025
Pirapetinga;Estação Caiapó;Praça Major Afonso s/nº - Distrito de Caiapó;BI;2025
Pirapetinga;Arquivo Jornalístico e Fotográfico do Jornal Alto São Francisco;"Praça Santana - Rua Tenente Norberto, esquina com Rua Capitão José Bifano; aos fundos, esquina com Rua José Ferreira de Souza, esquina com Rua Hamilton Martins, esquina com Rua Bento Martins, a sua direita a Praça tem como divisa a esquina da Rua Governador Benedito Valadares e esquina da Rua Carlos Luz";BI;
Pirapora;Antiga Estação Ferroviária;;BI;2012
Pirapora;Banco do Comércio;;BI;2011
Pirapora;Casa Doutor Camillo José dos Santos;;BI;2012
Pirapora;Casa Salomão Abdalla;;BI;2012
Pirapora;Escola Estadual Fernão Dias;;BI;2012
Pirapora;Gráfica Veredas;;BI;2011
Pirapora;Hotel Internacional;;BI;
Pirapora;Sobrado Tiburtino;;BI;2012
Pirapora;Conjunto de Instrumentos Musicais;;BM;2009
Pirapora;Complexo Portuário de Navegação do Rio São Francisco;;CP;2010
Pirapora;Conjunto Arquitetônico Pátio da Estação;;CP;
Pirapora;Ponte Marechal Hermes;;BI;
Piraúba;Antiga Estação Ferroviária e Armazém;;BI;2013
Piraúba;Cruzeiro;;BI;
Piraúba;Grupo Escolar Dona Maria Duarte Braga;;BI;2010
Piraúba;Conjunto de Instrumentos Musicais;;BM;2008
Piraúba;Conjunto Paisagístico da Praça Guarurama;;CP;2010
Pitangui;Imagem de Nossa Senhora das Dores;Acervo do Instituto Histórico de Pitangui - IHP;BM;2023
Pitangui;Chafariz;Praça Getúlio Vargas;BI;2006
Pitangui;Conjunto Paisagístico Capela da Cruz do Monte: Capela, Cruz e Miante do Cristo;Estrada Albertinho Valério;CP;2023
Pitangui;Capela da Cruz do Monte;;BI;
Pitangui;Capela da Penha;;BI;
Pitangui;Capela de Bom Jesus;;BI;
Pitangui;Capela de São José;;BI;
Pitangui;Casa do Velho da Taipa;;BI;
Pitangui;Santa Casa;;BI;2003
Piumhi;Capela Padre Francisco Weber;Rua Luiz Pereira de Souza s/nº - Bairro Padre Francisco Werber;BI;
Piumhi;Casa de Cultura;Praça Avelino de Queiroz nº193;BI;2005
Piumhi;Conjunto de desenhos de José II;asa de Cultura - Praça Doutor Avelino de Queiroz nº 193;BM;2004
Piumhi;Escola Municipal Doutor Avelino de Queiroz;Rua Bambuí nº56 - Centro;BI;2024
Piumhi;Arquivo Jornalístico e Fotográfico do Jornal Alto São Francisco;Rua Benedito Valadares nº 125 sala 07 - Centro;BM;2023
Piumhi;Praça Doutor Avelino de Queiroz;;CP;2014
Planura;Prefeitura Municipal de Planura;Esquina das ruas Sacramento e Monte Carmelo nº448 - Centro;BI;2022
Planura;Praça da Vila de Furnas;Avenida Marginal e ruas Sete,  Oito e João São Domingo;CP;2018
Planura;Álbum de Memórias de Dona Silvia - Professora Maria Ribeiro Duarte;Rua Doutor Sandoval Henrique de Sá nº74 - Centro;BM;2022
Planura;Antigo conjunto de mesa e cadeiras do gabinete da Prefeitura Municipal de Planura;Rua Quinze nº 40 - Vila de Furnas;BM;2019
Poço Fundo;Conjunto Paisagístico do Cemitério de Lourenço Westin;Bairro Campos do Jardim;CP;
Poço Fundo;Antigo Cine Ouro Negro;Praça São Francisco nº 144 - Centro;BI;2019
Poço Fundo;Imagem de São Francisco de Paula;;BM;2010
Poços de Caldas;Chalé Frayha - Antiga residencia do Barão de ltacurussá;Rua Pernambuco nº 95  -  Centro;BI;2025
Poços de Caldas;Escola Estadual David Campista - Antigo Sanatorium;Rua Mato Grosso nº 11 - Centro;BI;2025
Poços de Caldas;Conjunto Arquitetônico e Paisagístico do Colégio Municipal Doutor José Vargas de Souza;Avenida Champagnat nº 668 – Bairro de Vila Cruz;CP;2024
Poços de Caldas;Capela Dom Bosco;Avenida Coronel Virgílio Silva- Jardim Regina;BI;2004
Poços de Caldas;Antigo Mercado Municipal;Avenida Francisco Sales nº 770 - esquina com Rua Assis Figueiredo - Centro;BI;2020
Poços de Caldas;Fontes Termais – Conjunto Pedro Botelho e Macacos;Fonte Pedro Botelho: Praça. Doutor Elisiário Junqueira e Fonte Macacos: Praça Dom Pedro II;BI;2004
Poços de Caldas;Chalé Honório Dias;Praça Getúlio Vargas nº 04 - Centro;BI;2004
Poços de Caldas;Basílica de Nossa Senhora da Saúde;Praça Monsenhor Faria de Castro;BI;2023
Poços de Caldas;Complexo Ferroviário de Mogyana – FEPASA;Praça Paul Harris s/nº - Centro;BI;2004
Poços de Caldas;Coreto Praça Pedro Sanches;Praça Pedro Sanches;BI;
Poços de Caldas;Antigo Cassino da Urca;Rua Amazonas s/nº - Centro;BI;2004
Poços de Caldas;Sobrado Conde Prates;Rua Junqueiras n° 130 esquina com Rua Doutor Francisco Faria Lobato;BI;2018
Poços de Caldas;Igreja de São Sebastião;Rua nico Duarte nº 416;BI;2004
Poços de Caldas;Museu Histórico e Geográfico - Vila Junqueira;Rua Padre Henry Mothon s/nº;BI;2004
Poços de Caldas;Igreja de Santo Antônio;Rua São Paulo - Centro;BI;2004
Poços de Caldas;Conjunto Paisagistico Recanto do Japonês;Serra de São Domingos;CP;2024
Poços de Caldas;Capela de Santa Cruz;Travessa Santa Cruz s/nº;BI;2004
Poços de Caldas;Estação do Aeroporto Municipal;;BI;
Poços de Caldas;Thermas Antônio Carlos;;BI;
Poços de Caldas;Conjunto Arquitetônico e Paisagistico Parque José Afonso Junqueira - Complexo Hidrotermal e Hoteleiro;;CP;
Poços de Caldas;Serra de São Domingos;;CP;
Poços de Caldas;Chalé Christiano Osório;Rua Aquidauana nº 107- Jardim dos Estados;BI;2026
Pocrane;Carro de Boi;Córrego Barra Alegre;BM;2025
Pocrane;Conjunto Paisagístico da Praça Leoncio de Oliveira;;CP;2023
Pocrane;Busto de Leoncio de Oliveira;Praça Leoncio de Oliveira - Centro;BI;2023
Pompéu;Imagem do Nossa Senhora  Morto;Igreja de Nossa  Senhora da Conceição;BM;2008
Pompéu;Conjunto Paisagistico Lagoa do Quati - AABB;;CP;2021
Pompéu;Escola Estadual Doutor Jacinto Campos;Praça Governador Valadares nº 302 - Centro;BI;2004
Pompéu;Antiga  Prefeitura de Pompéu - Prefeitura Velha;Rua Padre João Porto nº 453 - Centro;BI;2022
Pompéu;Fazenda São Miguel: Sede;;BI;2024
Ponte Nova;Pontilhão Férreo;Avenida Custódio Silva  s/nº  sobre o rio Piranga, entre os bairros Palmeiras e Triângulo;BI;2008
Ponte Nova;Residência da Família Pinto Coelho;Avenida Doutor Caetano Marinho nº  235/239/245;BI;2009
Ponte Nova;Nucléo Histórico Urbano de Ponte Nova;;NH;2021
Ponte Nova;Imagem de São Sebastião;Igreja Matriz de São Sebastião - Praça Getúlio Vargas  s/nº;BM;2009
Ponte Nova;Igreja Matriz de São Sebastião;Praça Getúlio Vargas / Avenida Caetano Marinho - Centro;BI;2022
Ponte Nova;Cemitério dos Escravos;;BI;
Ponte Nova;Hotel Glória;Rua Antônio Frederico Ozanan nº 493 - Centro;BI;
Ponte Nova;Acervo Histórico do Arquivo Público de Ponte Nova;Rua Caetano Marinho nº 306 - Centro;BM;
Ponte Nova;Faculdade de Ciências Humanas - FAVAP;Rua Cantídio Drummond nº 92 - Centro;BI;2009
Ponte Nova;Residência da Família Brant Ribeiro;Rua Cantídio Drummond nº 11 - Centro;BI;2009
Ponte Nova;Hospital Nossa Senhora das Dores;Rua Doutor  Leonardo nº 200 - Centro;BI;2022
Ponte Nova;Fazenda Paciência;;BI;
Ponte Nova;Locomotiva a Vapor;;BM;
Ponto Chique;Roncador de Ponto Chique;Avenida nestor Alves Clementino nº 467 - Centro;BM;2024
Ponto Chique;Fazenda Tabocas;Estrada da Gameleira s/nº -  Distrito Gameleira;BI;2024
Ponto Chique;Conjunto Urbano e Paisagístico Orla Fluvial do Rio São Francisco;Orla Fluvial do Rio São Francisco - Geraldo Ferreira;CP;
Porteirinha;Capela de Nossa Senhora da Soledade de São José de Gorutuba;Estrada vicinal de São José de Gorutuba  s/nº;BI;2019
Porteirinha;Antiga Prefeitura Municipal;Praça Getúlio Vargas nº 37;BI;2019
Porteirinha;Capela Santos Reis;;BI;
Porteirinha;Casa de José Pedro;;BI;
Porteirinha;Escola Estadual João Alcântara;;BI;
Porteirinha;Igreja de Nossa Senhora da Saúde;;BI;
Porteirinha;Igreja de São Joaquim;;BI;
Porteirinha;Acervo documental do Cartório de Paz e Registro Civil;;BM;
Porteirinha;Imagem dos Três Reis Magos;;BM;
Poté;Imagem Nossa  Senhora da Conceição;Igreja  Matriz de Nossa Senhora da Conceição;BM;2000
Poté;Estação Ferroviária Bahia-Minas;Rua Agripíno Borges  s/nº - Distrito  Sucanga;BI;2000
Poté;Conjunto Residêncial da Extinta Bahia-Minas;Rua João Ferreira de Sá - Distrito de Valão;CP;2000
Poté;Estação Ferroviária Bahia-Minas;Rua João Ferreira de Sá;BI;2000
Pouso Alegre;Árvore Grande - Espécie Óleo de Copaíba;Não informado;BM;2026
Pouso Alegre;Capela de Santa Terezinha;Rua Afonso Pena nº304  - Centro;BI;
Pouso Alegre;Capela de São Benedito;Praça João Pinheiro, s/nº - Centro;BI;
Pouso Alegre;Monumento em Memória da Poetisa Presciliana Duarte;Cemitério Municipal de Pouso Alegre;BM;2026
Pouso Alegre;Teatro Municipal;Avenida  Doutor Lisboa nº 205 - Centro;BI;2001
Pouso Alegre;Casa dos Junqueiras;Avenida Abreu Lima  nº 84 - Centro;BI;2001
Pouso Alegre;Escola Estadual  Monsenhor José Paulino;Avenida Doutor Lisboa nº 323 - Centro;BI;2007
Pouso Alegre;Conservatório Estadual de Música Juscelino Kubitschek;Avenida Francisco Salles nº 116 - Centro;BI;2001
Pouso Alegre;Palácio Episcopal;Praça Dom Otávi nº 271 - Centro;BI;2001
Pouso Alegre;Antiga Estação Ferroviária - Casa de Cultura Menotti Del Piccha;Praça Josino Araújo s/nº- Centro;BI;2001
Pouso Alegre;Obelisco Nossa Senhora da Conceição;Praça Senador José Bento - Centro;BI;2001
Pouso Alegre;Clube Literário e Recreativo;Praça Senador José Bento nº 168 - Centro;BI;2001
Pouso Alegre;Fórum Orvietto Butti;Praça Senador José Bento nº 2 - Centro;BI;2001
Pouso Alegre;Fonte Luminosa da Independência;Praça Senador José Bento s/nº - Centro;BI;2001
Pouso Alegre;Sinos da Catedral Metropolitana;Praça Senador José Bento s/nº- Centro;BM;2021
Pouso Alegre;Circuito Estrada de Ferro Sapucaí;Rodovia BR 459 - Km 103;CP;2007
Pouso Alegre;Estátua do Bandeirante Fernão Dias;Rodovia Fernão Dias - BR 381;BI;2007
Pouso Alegre;Escola Estadual  Doutor José Marques Oliveira;Rua Bueno Brandão nº 220 - Centro;BI;2001
Pouso Alegre;Capela de Nossa Senhora de Fátima;Praça Nossa Senhora de Fátima s/n° - Bairro Fátima;BI;2026
Pouso Alegre;Catedral Metropolitana do Bom Jesus;Praça Senador José Bento s/nº - Centro;BI;
Pouso Alegre;Conjunto Arquitetônico Carmelo Sagrada Família;Rua Comendador José Garcia nº 1307 – Bairro Cascalho;BI;2023
Pouso Alegre;Capela do Sagrado Coração de Jesus - Capela de Santa Dorothéa;Rua Francisco Sales s/n° - Centro;BI;
Pouso Alegre;Santuário do Imaculado Coração de Maria;Igreja Matriz - Ladeira do Jaguar nº 2;BI;
Pouso Alto;Imagem de Nossa Senhora da Conceição;;BM;2006
Pouso Alto;Paço Municipal;Praça Desembargador Ribeiro da Luz  s/nº;BI;2004
Pouso Alto;Antigo Solar dos Barões;;BI;
Pouso Alto;Conjunto Paisagístico  e Arquitetura Igreja Matriz: escadaria da ladeira do Jaguar e calçamento da Rua Barão de Pouso Alto;;CP;2007
Prados;Conjunto Urbano Passos da Paixão;"PASSO 01- Rua  Coronel  José Manoel entre nº16 e s/nº; PASSO 02 -Rua Coronel José Manoel entre, nº38 e nº 86; PASSO 03- Rua Coronel João Luiz entre, nº143 e nº173; PASSO 04 - Rua Coronel João Luiz entre nº 72 e nº 82; PASSO 05 - Rua  Professor Antônio Américo, entre nº3 e nº5";CP;2009
Prados;Teatro Municipal Prefeito José Café;Praça Doutor Viviano Caldas nº 66 - Centro;BI;2016
Prados;Acervo de partituras da Lira Ceciliana;Rua Coronel João Luís nº 141;BM;2007
Prados;Selaria Estrela Ltda.;Rua Coronel José Manoel nº 61;BI;2006
Prados;Núcleo Histórico de Prados;;NH;2012
Prados;Núcleo Histórico Povoado Vitoriano Veloso - Bichinho;;NH;2012
Prata;Estátua Nossa Senhora do Carmo;Morrinho Seio de Moça, 1,5 km acima da Rodovia BR 497;BI;2026
Prata;Conjunto Urbano e Paisagístico da Praça João Paulino de Freitas;"latitude 19°33'22.03""S e longitude 49°15'16.08""O - Distrito de Monjolinho";CP;2026
Prata;Imagem de Nossa Senhora dos Passos - Igreja Matriz;Praça 15 de Novembro nº 251;BM;2005
Prata;Igreja de Nossa Senhora do Rosário;Praça Getúlio Vargas nº 51;BI;2006
Pratápolis;Antiga Estação Ferroviária;;BI;2007
Pratápolis;Imagem de São Sebastião;;BM;2009
Pratápolis;Conjunto Paisagístico Trecho Urbano da Estrada de Ferro;;CP;2010
Pratinha;Matriz de Santo Antônio;;BI;2023
Presidente Bernardes;Núcleo Histórico da Praça Cônego Lopes;;NH;2020
Presidente Bernardes;Antiga Prefeitura Municipal;Rua Cônego Lopes nº 09 - Centro;BI;2012
Presidente Juscelino;Arquivo do Cartório de Registro Civil e Notas;Praça  Achiles Couto s/nº;BM;2008
Presidente Juscelino;Ruínas da Ponte do Paraúna;;BI;2009
Presidente Juscelino;Conjunto Sítio Natural Reserva Água Doce;;CP;2010
Presidente Kubitschek;Igreja Nossa Senhora das Dores;Praça Doutor Waldir de Ávila, s/nº;BI;2009/2010
Presidente Kubitschek;Imagem Nossa Senhora das Dores;Igreja Nossa Senhora das Dores = Praça Doutor Waldir de Avila;BM;2009/2010
Presidente Kubitschek;Calçamento de Pedras;;CP;2010
Presidente Olegário;Antiga Capela Nossa Senhora da Abadia;Rua Capitão João Rodrigues Braga, s/nº;BI;2009
Presidente Olegário;Carro de Boi Chapeado;Fazenda do Senhor José Januário;BM;2012
Presidente Olegário;Núcleo Histórico de Vila de Ponte Firme;;NH;2010
Prudente de Morais;Acervo da Guarda de  Nossa Senhora do Rosário;Capela de Nossa Senhora do Rosário - Praça Santa Cruz nº 264;BM;2004
Prudente de Morais;Sítio Paisagístico da Lagoa do Cercado;Fazenda da Lapa;CP;2004
Prudente de Morais;Capela de São Sebastião -  Serrinha;Fazenda Lapa Preta;BI;2001
Queluzito;Núcleo Histórico;Praça Santo Amaro  Rua Padre Gurgel  Rua Bernardino Pena e Rua do Rosário - Centro;NH;2007
Queluzito;Igreja Matriz de Santo Amaro;Praça Santo Amaro  s/nº - Centro;BI;2009/2010
Queluzito;Jeep-Willys;;BM;2005
Raposos;Ponte de Ferro - Pontilhão na Antiga Linha Férrea de  Raposos a  Honório Bicalho;Antiga Linha Férrea  sentido Raposos / Honório Bicalho  a uma distância de 2,5 km da Estação Ferroviária no  - Centro da Cidade;BI;
Raposos;Imagem de Nossa Senhora do Rosário com o Menino Jesus;Capela de Nossa Senhora do Rosário;BM;2001
Raposos;Capela Nossa Senhora do Rosário;Largo do Rosário;BI;2001
Raposos;Estação Ferroviária;Lat. S19º57'59.15980” / Long. W43º48'26.75990”;BI;2004
Raposos;Antiga Fábrica do Fósforo Luz Mineira - Atual Escola Estadual Dom Cirilo;Praça da Matriz nº 96;BI;2022
Raposos;Clínica de Fisioterapia e Saúde Mental - Antigo Grupo de Compras;Rua Geraldo Gomes de Lima nº 209 - Centro;BI;
Raposos;Creche Menino Jesus;Rua Geraldo Gomes de Lima nº 175 - Centro;BI;2022
Raposos;Igreja Matriz de Nossa Senhora da Conceição;Rua José Calixto dos Anjos nº 88 - Centro;BI;2022
Raposos;Pontilhões da Estrada de Ferro Dom Pedro II;Vila Bela;BI;
Raposos;Mananciais e respectivas áreas de proteção da Bacia do Ribeirão da Prata;"Latitude 19°58'20.25""S / Longitude 43°48'0.32""O";CP;2001
Raposos;Matriz Nossa Senhorada Conceição de Raposos;;BI;
Raul Soares;Antiga Estação Ferroviária de Raul soares;Avenida Getúlio Vargas nº 200 - Centro;BI;2021
Raul Soares;Conjunto Paisagístico Praça Doutor Durval Grossi;Praça Doutor Durval Grossi;CP;2020
Raul Soares;Vitrais da Igreja Matriz de São Sebastião;Praça Padre José Domingues s/nº;BM;2003
Raul Soares;Imagem do Senhor Morto;Praça Padre José Domingues s/nº - Centro;BM;2011
Raul Soares;"Conjunto dos bens imóveis pertencentes na Antiga Rede Ferroviária : Estação Ferroviaria Raul Soares ; Pontilhão Ferroviário da entrada de Raul Soares;  Pontilhão Ferroviário no Centro de Raul Soares; Estação Ferroviária e Anexo Capitão Martins;   Estação Ferroviária Cornélio Alves; Estação Ferroviária Anexo e Caixa d'água de Vermelho Velho;  Pontilhão Ferroviária São Vicente da Estrela";;CP;
Recreiro;;;;
Resende Costa;Igreja Matriz Nossa Senhora da Penha de França;"O templo é circundado por três praças: uma voltada para sua face frontal, Praça Cônego Cardoso; outra na sua face esquerda, Praça Nossa Senhora de Fátima; e a última voltada para a face posterior, Praça Mendes Resende.";BI;2025
Resende Costa;Ruínas da Fazenda dos Campos Gerais;;BI;2025
Resende Costa;Solar dos Pinto - Câmara Municipal;Rua Maria da Costa Fernandes esquina com a Praça Nossa Senhora de Fátima;BI;2025
Resende Costa;Ruínas da Fazenda da Laje: Sede;Estrada que liga Resende Costa a São Tiago;BI;2025
Resende Costa;Imagem Nossa Senhora do Carmo;Museu de Arte Sacra da Matriz de Nossa Senhora da Penha de França - Praça Cônego Cardoso;BM;2006
Resende Costa;Antigo Teatro Municipal;Avenida Prefeito Ocacyr Alves de Andrade nº 120 - Centro;BI;2009
Resende Costa;Conjunto Paisagísitco Fazenda das Éguas;;CP;2010
Resplendor;Ponte Engenheiro Paulo Maurício Sampaio  - Ponte do Rio Doce;Rua Emílio Brostel s/nº - Centro;BI;2026
Resplendor;Conjunto Paisagístico Arqueológico Pedra Pintura;Parque Estadual dos Sete Salões - UTM 251812,00 m E e 7870075,00 m S;CP;2026
Resplendor;Cadeira do 1º Prefeito de Resplendor;Rua Jarbas Franco nº 11 - Centro;BM;2026
Ressaquinha;Oratório da Antiga Ermida da Fazenda Costa da Mina - Oratório da Ermida São João Nepomuceno;Lar de Proteção às Jovens – Praça Nossa Senhora Aparecida nº 480 – Sociedade de Educação e Assistência Social Santa Clara;BM;2025
Ressaquinha;Conjunto Paisagístico da Praça Pio XII;Margens da Rodovia Juscelino Kubitscheck/BR 040 e no entorno da Igreja Matriz de São José – Centro;CP;2021
Ressaquinha;Antiga Estação Ferroviária de Ressaquinha;Praça Dom Pedro II nº 20 - Centro;BI;2016
Ressaquinha;Jardins da Matriz;Praça Pio XII -BR 040;BI;
Ressaquinha;Imagem de São José;Igreja Matriz de São José - Rua Padre Geraldo Magela nº 01 - Centro;BM;2018
Ressaquinha;Capela de Santana  São José e Nossa Senhora do Rosário;;BI;
Ressaquinha;Capela Nossa Senhora Aparecida;;BI;
Ressaquinha;Casa do Agente;;BI;
Ressaquinha;Escola Municipal Belisário Moreira;;BI;
Ressaquinha;Igrerja Matriz – Paróquia de São José;;BI;
Ressaquinha;Delegacia de Polícia;;BI;
Ressaquinha;Prefeitura Municipal - Estação e Casa do Agente;;BI;
Ressaquinha;Monumento da Praça Tiradentes;;BIntegrado;2026
Ressaquinha;Praça Tiradentes;à beira da BR-040 - antiga BR-3;CP;
Riachinho;Alameda Antônio José Barbosa;Avenida JK s/nº  - Centro;CP;2024
Ribeirão das Neves;Conjunto Arquitetônico da Penitenciária José Maria Alkimim;Praça da Esplanada s/nº - Centro;BI;
Ribeirão das Neves;Campanário e Cruzeiro da Matriz de Nossa Senhora da Piedade;Rua Camélia Loffi;BI;
Ribeirão das Neves;Igreja da Colina;Rua Trinta e Oito nº 115 - Bairro San Marino;BI;
Ribeirão das Neves;Sino da Praça da Matriz;;BM;
Ribeirão das Neves;Conjunto  Arquitetônico e Paisagístico da Igreja da Colina;;CP;
