cidade;denominacao_do_bem_tombado;endereco;tipo;ano_de_tombamento
Ouro Preto;Conjunto Arquitetônico e Arqueológico da Capela de Nossa Senhora Auxiliadora de Calastróis e Cemitérios - 0,39 ha;Não informado;CP;Não informado
Pai Pedro;Estação Ferroviária de Pai Pedro;Estrada de Ferro, s/nº;BI;2024
Pains;Conjunto Paisagístico Pedra do Cálice - Fazenda Aguada do Córrego Fundo - 0,0532 ha;Fazenda Aguada do Córrego Fundo;CP;2012
Pains;Caminhão GM - Chevrolet 1950;Praça Tonico Rabelo, nº164, Centro;BM;2023
Pains;Escola Municipal Professor João Batista Rodarte;Rua Gonçalves de Melo nº 219 - Centro;BI;2007
Paiva;Antiga Estação Ferroviária;Praça Augusto Ferreira, km 360, Centro;BI;2021
Paiva;Conjunto Paisagístico da Praça Geraldo de Paiva - 0,61 ha;Não informado;CP;2012
Paiva;Fazenda Olaria I;Não informado;BI;2003
Paiva;Imagem de São Sebastião;Não informado;BM;2011
Palma;Prefeitura Municipal;Praça Getúlio Vargas, nº26 - Centro;BI;2022
Palmópolis;Igreja Santo Antônio;Não informado;BI;2003
Papagaios;Igreja Matriz de São Sebastião;Praça Padre Waldemar,s/nº;BI;2007
Pará de Minas;Gruta Nossa Senhora de Lourdes - 0, 005 ha;Distrito de Ascenção;CP;2004
Pará de Minas;Fórum Desembargador Pedro Nestor;Praça Afonso Pena;BI;2001
Pará de Minas;Escola Estadual Fernando Otávio: Fachada frontal;Praça Frei Concordio nº 750;BI;2007
Pará de Minas;Ex-Estação Ferroviária;Praça Torquato de Almeida nº 177;BI;2011
Pará de Minas;Escola Municipal Torquato de Almeida;Praça Torquato de Almeida nº 22;BI;2013
Pará de Minas;Casa de Cultura Presidente Juscelino Kubistchek de Oliveira - Antigo Grande Hotel;Praça Torquato de Almeida nº 26 - Centro;BI;2013
Pará de Minas;Centro Literário Pedro Nestor;Rua Benedito Valadares nº 183;BI;2003
Pará de Minas;Irmandade de Nossa Senhora da Conceição - Hospital;Rua Benedito Valadares nº 358;BI;2007
Pará de Minas;Escola Estadual Governador Valadares;Rua Delfim Moreira nº 80;BI;2013
Pará de Minas;Escola Municipal de Artes e Ofícios Raimundo Nogueira de Faria - Sica;Rua Doutor Higino s/nº;BI;2007
Pará de Minas;Casa Maria Capanema;Rua Joaquim Peregrino nº 38;BI;2004
Pará de Minas;Museu Histórico, Documental, Fotográfico e do Som;Rua Manoel Batista nº 51;BI;2001
Pará de Minas;Igreja Nossa Senhora das Graças;Rua Nossa Senhora das Graças  s/nº - Bairro Nossa Senhora das Graças;BI;2004
Pará de Minas;Asilo Padre José Pereira Coelho -FAPAM;Rua Ricardo Marinho nº 47;BI;2001
Pará de Minas;Cristo Redentor;Serra de Santa Cruz;BI;2004
Pará de Minas;Conjunto de telas da Antiga Matriz de Nossa Senhora da Piedade: 09 telas - Ressurreição de Cristo, Anjos com incensórios, Ascenção de Cristo, Imaculada Conceição, São Jacob e São Philipp, Apóstolos São João e São Thiago, Divino Espírtio Santo, Nossa Senhora da Piedade;FAPAM - Rua Ricardo Marinho nº47 e MUSPAM - Rua Manoel Batista nº 51;BM;2013
Pará de Minas;Núcleo Histórico Urbano do Distrito de Ascenção - 71 unidades;Não informado;NH;2013
Pará de Minas;Núcleo Histórico Urbano do Distrito de Carioca - 49 unidades;Não informado;NH;2013
Pará de Minas;Praças Torquato de Almeida e Francisco Torquato de Almeida - 0,45 ha;Não informado;CP;2007
Paracatu;Capela de São Sebastião;Comunidade de São Sebastião;BI;2025
Paracatu;Casa de Cultura de Paracatu;Rua Ávila, s/nº - Centro;BI;2020
Paracatu;Painel de Nossa Senhora Rosário  São Domingos e Santa Catarina de Siena;Casa da Cultura de Paracatu - Rua Ávila,s/nº - Centro;BM;2020
Paracatu;Núcleo Histórico Urbano  - 385 unidades;Não informado;NH;2023
Paracatu;Igreja de Santo Antônio;Travessia, nº 1, Povoado de Lagoa de Santo Antônio;BI;2024
Paraguaçu;Sítio Leva-Tapas;Parque dos Pinheiros - Avenida Antônio Labeca s/nº, esquina com Rua José Ronaldo Leite;BI;2008
Paraguaçu;Escola Municipal Luiz de Melo Viana Sobrinho - ex FEDEOP;Avenida Dom Bosco, nº342;BI;2012
Paraguaçu;Antiga Caixa d'Água;Avenida Dom Bosco,s/nº;BI;2009
Paraguaçu;Ipê Amarelo;Avenida Dom Bosco,s/nº;BI;2022
Paraguaçu;Capela do Cemitério;Avenida Presidente Vargas s/nº;BI;2008
Paraguaçu;Ponte Velha do Baguary;Cruzamento no Rio Sapucaí - divisa municípios de Paraguaçu e Elói Mendes- nas margens da Rodovia do Café -BR-491, km 213;BI;2023
Paraguaçu;Oratório;Praça João Eustáquio da Costa nº 173;BM;2007
Paraguaçu;Igreja Nossa Senhora da Aparecida;Praça João Eustáquio da Costa nº 201;BI;2012
Paraguaçu;Prédio da Associação David Gantus Nasser;Praça João Eustáquio da Costa nº 201;BI;2009
Paraguaçu;Teatro Municipal Donato Leite Andrade;Praça Osvaldo Costa nº 203;BI;2007
Paraguaçu;Praça Oswaldo Costa - 1,021 ha;Praça Oswaldo Costa;CP;2009
Paraguaçu;Hotel Paraguassu;Praça Oswaldo Costa, nº211 - Centro;BI;2023
Paraguaçu;Arvore da Rodoviária;Praça Pedro Leite s/nº -  Centro;BI;2022
Paraguaçu;Horto Florestal da Bomba - Parque Natural Municipal Coronel Olyntho Oliveira Leite - 14,11 ha;Rua 7 de Setembro, 461, Paraguaçu;CP;2024
Paraguaçu;Antiga Prefeitura Municipal;Rua Ferreira Prado nº 138;BI;2008
Paraguaçu;Edificação;Rua Ferreira Prado nº 72;BI;2008
Paraguaçu;Edificação;Rua José Camilo da Costa nº 62;BI;2008
Paraguaçu;Avião Monumento;Trevo da cidade - BR 491;BI;2012
Paraisópolis;Residência da Família Tavares;Rua Bueno de Paiva, nº136, Centro;BI;2025
Paraisópolis;Edificação;Rua Marechal Deodoro, nº131, Centro;BI;2025
Paraisópolis;Departamento de Educação;Praça do Centenário nº74;BI;2025
Paraisópolis;Residência Dona Terezinha;Avenida São Vicente de Paula s/nº;BI;2006
Paraisópolis;Caixa d'Água;Avenida São Vicente de Paula s/nº - Centro;BI;2006
Paraisópolis;Parque Municipal do Brejo Grande - 217,94 ha;Bairro Serra dos Goulart;CP;2005
Paraisópolis;Mercado Municipal;Calçadão da Rua São José esquina com Praça Presidente Vargas - Centro;BI;2022
Paraisópolis;Ponte de ferro sobre o Rio Sapucaí-Mirim;Estrada vicinal Paraisópolis / Conceição dos Ouros s/nº - Bairro Ponte de Ferro - Zona Rural;BI;2006
Paraisópolis;Grupo Escolar Bueno de Paiva;Praça Coronel José Vieira nº 58 - Centro;BI;2006
Paraisópolis;Paço Municipal Presidente Tancredo Neves;Praça do Centenário nº 103 - Centro;BI;2006
Paraisópolis;Centro Educacional e Cultural Amilcar de Castro – Antiga Estação Ferroviária;Rua Governador Benedito Valadares s/nº - Centro;BI;2003
Paraisópolis;Escultura de Amilcar de Castro;Centro Educacional e Cultural Amilcar de Castro - Antiga estação ferroviária - Rua Governador Benedito Valadares s/nº - Centro;BM;2003
Paraisópolis;Casarão das Irmãs Carvalho;Rua Sete de Setembro nº 702 - Centro;BI;2014
Paraopeba;Capela de Nossa Senhora da Conceição;Avenida Barão Antônio Cândido nº 115 - Centro;BI;2024
Paraopeba;Jornal Gazeta de Paraopeba - Conjunto de Edições do Jornal Gazeta de Paraopeba;Biblioteca Publica Municipal Aguinaldo Edmundo - Rua Primeiro de Junho nº 72 - Centro;BM;2004
Passa Quatro;Acervo Literário do Escritor Pedro Mossri;Casa da Cultura  - Rua Cabo Deodato nº 20 - Centro;BM;2025
Passa Quatro;Edificação;Avenida Coronel Ribeiro Pereira nº 508 - Centro;BI;2007
Passa Quatro;Conjunto Paisagístico do Jardim Julio Regnier - 0,28 ha;Jardim Julio Regnier;CP;2024
Passa Quatro;Estação Ferroviária de Passa Quatro;Praça Doutor Paulo de Frontin nº 80 - Centro;BI;2007
Passa Quatro;Edificação;Rua Ângelo D' Alessandre n° 137 - Centro;BI;2007
Passa Quatro;Casa de Cultura - Biblioteca Pública Afonso Lopes de Almeida;Rua Cabo Deodato nº 20 - Centro;BI;2007
Passa Quatro;Charrete da Família Hess;Casa de Cultura - Rua Cabo Deodato nº 20 - Centro;BM;2004
Passa Quatro;Igreja Matriz de São Sebastião;Rua Cônego Olavo s/nº - Centro;BI;2022
Passa Quatro;Associação Comercial  Associação Industrial e Agropecuária de Passa Quatro - ACIPAQ;Rua Doutor Arlindo Luz nº 137;BI;2023
Passa Quatro;Edificação;Rua Tenente Viotti n° 100 - Centro;BI;2009
Passa Quatro;Edificação;Rua Tenente Viotti n° 526 - Centro;BI;2007
Passa Quatro;Conjunto Paisagístico Calçamento Malha Urbana do Centro de Passa Quatro - 4,8 ha;"TRECHO 01: Avenida Coronel Ribeiro Pereira; TRECHO 02: Rua Tenente Joaquim Tiburcio; Rua Alcides Carneiro;  Rua Cônego Olavo; Avenida Coronel Olímpio de Almeida; Rua Cônego Monte Raso; Rua Padre Manoel; Rua Fracisco Saulle;  Rua Basílio Borges; Rua Romeu Hespanha; Rua Oliveria Leite; Rua Dona Luiza; Rua Brandão Carneiro; Rua Itamonte (Rua Osvaldo Orlando da Costa); Rua Itanhandu; Rua Caxambu; Rua Doutor Almeida; TRECHO 03: Rua Tenente Viotti;  Rua Ângelo D'Alessandro; R. Capitão Francisco Mota; Rua Padre Arlindo Luiz; Avenida Benedito Valadares; Rua Antônio Cardoso; Rua Cabo Deodato; Rua General Barcelos; Praça Doutor Alckimin; Praça Doutor Manuel Alves Castro; Rua Itajubá; TRECHO 04: Rua Floriano Cancela; Praça  Ludgero Guedes; Rua Luiz Antônio; Largo Diamantino Pereira; Praça Nossa Senhora Aparecida; Rua Saboia Lima; Avenida Getúlio Vargas; Praça Doutor Paulo de Frontin; Rua Doutor Daniel de Carvalho; Rua Capitão Bonani; Rua Doutor Ismael de Souza; Rua Ivan Mota Dias (Rua Pouso Alto); Rua Doutor Leopoldo de Luna;  Rua Baependi; Mário José Ribeiro; Rua Major  Antônio Tiburcio;";CP;2006
Passa Quatro;Núcleo Histórico Urbano - 406 unidades;Não informado;NH;2010
Passa Tempo;Capela Nossa Senhora do Rosário;Avenida Donato Andrade s/ nº;BI;2013
Passa Tempo;Grupo Escolar Gabriel Andrade;Praça Bolívar Andrade;BI;2010
Passa Tempo;Imagem de Santo Antônio;Igreja Matriz de Nossa Senhora da Glória - Praça Bolívar Andrade s/nº;BM;2012
Passa Tempo;Ostensório de Prata e Ouro;Igreja Matriz de Nossa Senhora da Glória - Praça Bolívar Andrade s/nº;BM;2012
Passa Tempo;Crucificado Senhor do Bonfim ou Crucifixo do Beijo;Igreja Matriz de Nossa Senhora da Glória - Praça Bolívar Andrade s/nº;BM;2012
Passa Tempo;Cruz Processional;Igreja Matriz de Nossa Senhora da Glória - Praça Bolívar Andrade s/nº;BM;2012
Passa Tempo;Imagem de Nossa Senhora da Glória;Igreja Matriz de Nossa Senhora da Glória - Praça Bolívar Andrade s/nº;BM;2009
Passa Tempo;Imagem de Nossa Senhora da Soledade;Igreja Matriz de Nossa Senhora da Glória - Praça Bolívar Andrade s/nº;BM;2012
Passa Tempo;Delegacia e Cadeia;Praça Bolívar de Andrade nº 21;BI;2010
Passa Tempo;Fórum Desembargador Costa Loures;Praça Bolívar de Andrade nº76;BI;2010
Passa Tempo;Coreto Guilherme Alves de Andrade;Praça Bolívar de Andrades/nº;BI;2010
Passa Tempo;Igreja Matriz Nossa Senhora da Glória;Praça Bolívar de Andrade s/nº;BI;2010
Passos;Estação Cultura;Avenida da Estação s/nº;BI;2008
Passos;Palácio da Cultura;Praça Geral do Silva Maia, s/nº, Centro;BI;2024
Passos;Acervo Wagner de Castro;Casa da Cultura - Praça Geraldo da Silva Maia s/nº;BM;2005
Passos;Fonte Luminosa da Praça Geraldo Silva Maia s/nº;Praça Geraldo Silva Maia s/nº;BI;2012
Passos;Árvore de Santa Bárbara;Praça Santa Bárbara;BI;2008
Passos;Escola Municipal Professora Francina de Andrade;Rua Coronel neca Medeiros nº181;BI;2008
Passos;Parque Municipal Doutor Emílio Piantino - 6,259 ha;Rua New York;CP;2005
Passos;Capela Centenária Nossa Senhora da Penha;Travessa Joaquim Lopes s/nº;BI;2008
Passos;Praça Geraldo da Silva Maia - 1,672 ha;Não informado;CP;2013
Patos de Minas;Escola Estadual Professor Antônio Dias Maciel;Avenida Getúlio Vagas nº 45;BI;2007
Patos de Minas;Palácio dos Cristais;Avenida Getúlio Vargas nº 230;BI;2006
Patos de Minas;Fórum Olympio Borges;Avenida Getúlio Vargas nº 245;BI;2007
Patos de Minas;Escola Estadual Marcolino de Barros;Avenida Getúlio Vargas nº 367;BI;2001
Patos de Minas;Residência do ex-Presidente Olegário Dias Maciel;Avenida Getúlio Vargas nº 78;BI;2001
Patos de Minas;Estação Aeroportuária Comandante José Portinho;Avenida Maria Conceição Borges Filha s/nº - Bairro Planalto;BI;2006
Patos de Minas;Igreja Santa Terezinha do Menino Jesus;Avenida Paranaíba nº 1492;BI;2002
Patos de Minas;Conjunto Paisagístico da Ponte sobre o Córrego Chumbo-Lajeado - 2 ha;Distrito de Major Porto;CP;2006
Patos de Minas;Conjunto Paisagístico da Fazenda Experimental de Sertãozinho - 240 ha;Km 16 da MG 354;CP;2004
Patos de Minas;Altar-mor da antiga Matriz de Santo Antônio;Localidade de Ponto Chic - Distrito Sede;BM;2003
Patos de Minas;Herma de Olegário Maciel;Museu da Cidade de Patos de Minas/MUP, Casa de Olegário Maciel - Avenida Getúlio Vargas nº 78;BM;2019
Patos de Minas;Igreja Nossa Senhora das Dores do Areado;Praça Arlindo Porto s/nº - Vila do Chumbo;BI;2012
Patos de Minas;Casa Doutor Itagyba;Praça Dom Eduardo nº 11;BI;2023
Patos de Minas;Catedral de Santo Antônio de Pádua;Praça Dom Eduardo s/nº;BI;2023
Patos de Minas;Igreja Matriz de Santana;Praça Jaime Ramos s/nº - Santana de Patos;BI;2007
Patos de Minas;Cadeia Pública;Praça Juquinha Caixeta s/nº;BI;2001
Patos de Minas;Mercado Municipal de Patos de Minas;Praça Santana, s/nº - Centro;BI;2021
Patos de Minas;Conjunto Paisagístico da Ponte Rio Paranaíba -2 ha;Não informado;CP;2012
Patos de Minas;Praça Dom Eduardo;Não informado;CP;2012
Patos de Minas;Avenida Getúlio Vargas - Quadras Centrais;Não informado;CP;2001
Patrocínio;Escola Estadual Dom Lustosa;Avenida Afonso Pena,nº 600;BI;2010
Patrocínio;Acervo Fotográfico da Casa da Cultura;Casa de Cultura: Praça Monsenhor Brandão, 448 - Centro;BM;2002
Patrocínio;Palácio do Ensino;Praça Honorato Borges, 755 - Centro;BI;2010
Patrocínio;Escola Honorato Borges;Praça Honorato Borges, s/nº - Centro;BI;2010
Patrocínio;Casa da Cultura;Praça MonsenhorBrandão, 448;BI;2002
Patrocínio;Estação Ferroviária;Rua João de Carvalho,s/nº - Centro;BI;2010
Patrocínio;Antigo Banco do Comércio e Indústria de Minas Gerais - Mansão Brandão - Destombado através de senteça judicial 2021;Não informado;BI;2010
Patrocínio;Praça MonsenhorThiago -1,36 ha;Não informado;CP;2002
Patrocínio;Serra do Cruzeiro - 356,4 ha;Não informado;CP;2003
Patrocínio do Muriaé;Conjunto Paisagístico e Arquitetônico da Estação Ferroviária - 0,2287 ha;Praça Vicente Severino Vasconcelos - Avenida Silveira Brum s/nº - Bairro Centro;CP;2019
Patrocínio do Muriaé;Ponte Metálica - Ponte Carvalho Brito;Rua João Pinheiro s/nº;BI;2022
Paula Cândido;Capela Mortuária de Nossa Senhora das Graças;Rua Alfredo Postch s/nº;BI;2010
Paula Cândido;Busto do Professor Samuel João de Deus;Rua Monsenhor Lisboa s/nº;BM;2008
Paulistas;Conjunto Paisagístico Cachoeira Geraldo Miranda - 13,875 ha;Fazenda Ponte Nova - Zona Rural;CP;2004
Paulistas;Capela e Gruta de Nossa Senhora de Lourdes;Praça Antônio Arguelles Nunes;BI;2004
Paulistas;Imagem de Santana Mestra;Rua Padre José Sampaio nº 500;BM;2004
Peçanha;Cadeira do Gabinete do Prefeito;Avenida dos Braga nº 118 - Centro;BM;2003
Peçanha;Biblioteca Municipal - antigo Paço Municipal;Avenida dos Braga nº 118 - Centro;BI;2003
Peçanha;Parque Municipal Mãe d'Água - 13,25 ha;Rua do Rosário s/nº;CP;2003
Pedra Azul;Acervo de 61 peças Sacras da Igreja Matriz de Nossa. Sra. da Conceição;Igreja de Nossa Senhora da Conceição;BM;2000
Pedra Azul;Casa de Onofre;Avenida Colatina Antunes nº 58;BI;2000
Pedra Azul;Casa do Senhor Hormino;Avenida Colatino de Almeida nº 21;BI;2000
Pedra Azul;Casa Paroquial;Avenida Colombo Antunes nº 103;BI;2000
Pedra Azul;Casa do Doutor Álvaro Neves;Avenida João de Almeida nº 345;BI;2000
Pedra Azul;Núcleo Histórico - 53 unidades;Centro Urbano de Pedra Azul;NH;2000
Pedra Azul;Santuário de Nossa Senhora da Conceição;Praça Coronel Joaquim Antunes s/nº;BI;2000
Pedra Azul;Administração Fazendária;Praça Hormínio de Almeida nº 236;BI;2000
Pedra Azul;Casa de João Pires;Praça João Lima Pires nº 09;BI;2000
Pedra Azul;Bar do Heitor;Praça João Lima Pires nº 36;BI;2000
Pedra Azul;Casa João de Almeida;Praça João Lima Pires s/nº;BI;2000
Pedra Azul;Casa Doutor Manoelzito;Praça Joaquim Antunes nº 214;BI;2000
Pedra Azul;Casa de Dona Raquel;Praça Joaquim Antunes nº 77;BI;2000
Pedra Azul;Villa Carmina;Praça Teopompo de Almeida nº 118;BI;2000
Pedra Azul;Casa de Sílvio Faria;Praça Teopompo de Almeida nº 140;BI;2000
Pedra Azul;Quadro: O Homem do Campo;Praça Teopompo de Almeida, nº250 - Centro;BM;2000
Pedra do Anta;Imagem de São Sebastião;Igreja de São Sebastião, Praça José Ferreira de Paiva, nº420 - Centro;BM;2010
Pedra do Anta;Igreja Nossa Senhora do Rosário;Praça do Rosário,s/nº - Bairro do Rosário;BI;2012
Pedra do Indaiá;Imagem do Senhor Bom Jesus;Igreja Matriz Senhor Bom Jesus;BM;2010
Pedra do Indaiá;Capela São Miguel Arcanjo;Rua Paraná,s/nº;BI;2007
Pedra Dourada;Residência Francisco Ventura Marinho;Rua Luiz Viegas nº 51;BI;2007
Pedra Dourada;Livros de Atas do Ginásio Municipal: 1969 - 1985;Rua Glycério Dias Soares nº178;BM;2007
Pedra Dourada;Conjunto Paisagístico da Pedra Dourada - 22,37 ha;Não informado;CP;2007
Pedralva;Herma Gaspar José de Paiva;Praça Carneiro Rezende - Praça da Matriz de São Sebastião;BM;2018
Pedrinópolis;Conjunto Paisagístico da Praça São Sebastião - <2 ha;Centro;CP;2023
Pedrinópolis;Casa da Memória;Rua Doutor Virgílio nº211;BI;2010
Pedrinópolis;Carro de Boi;Rua Doutor Virgílio nº211 - Centro;BM;2010
Pedro Leopoldo;Praça interna da Fábrica dos tecidos - 0,562 ha;Bairro Cachoeira Grande;CP;2007
Pedro Leopoldo;Estação Doutor Lund;Praça Anibal Fernandes;BI;2004
Pedro Leopoldo;Conjunto da Estação Ferroviária Pedro Leopoldo - 2 ha;Rua Anélio Caldas e Rua  Herbster;CP;2004
Pedro Leopoldo;Conjunto Residencial - 2,49 ha;Rua Nossa Senhora da Saúde - Bairro Cachoeira Grande;CP;2007
Pedro Leopoldo;Conjunto Residencial -1,12 ha;Rua São Paulo - Bairro Cachoeira Grande;CP;2007
Pedro Leopoldo;Associação Beneficente;Não informado;BI;2000
Pedro Leopoldo;Fábrica de Tecidos Cachoeira Grande;Não informado;BI;2007
Pedro Leopoldo;Corporação Musical Cachoeira Grande e Casa do Açougue da Cooperativa;Não informado;BI;2007
Pedro Leopoldo;Casa de Máquina e Casa de Força da Fábrica de Tecidos;Não informado;BI;2007
Pedro Leopoldo;Conjunto da Antiga Companhia Industrial - Horizonte Têxtil;Não informado;BI;2007
Pedro Leopoldo;Imagem de São Benedito;Não informado;BM;2004
Pequeri;Imagem de São Pedro;Casa Paroquial da Matriz de São Pedro de Pequeri;BM;2013
Pequi;Capela de Nossa Senhora do Rosário;Praça do Rosário - Centro;BI;2025
Pequi;Cruzeiro do Ponto Chic - Cruzeiro de Padre Libério;Alto da Serra do Rio do Peixe - Ponto Chique;BM;2025
Perdizes;Conjunto Urbano e Paisagístico Praça Maria Joaquina do Espírito Santo - 0,14 ha;Praça Maria Joaquina do Espírito Santo, Distrito de São José de Antinha;CP;2024
Perdizes;Igreja Matriz Nossa Senhora da Conceição;Não informado;BI;2008
Perdizes;Imagem de São Sebastião;Não informado;BM;2008
Perdões;Imagem do Senhor Bom Jesus de Perdões;Altar-Mor da Igreja Matriz Senhor Bom Jesus;BM;2004
Perdões;Praça José Modesto Sobrinho - 0,121 ha;Centro;CP;2004
Perdões;Praça Zoroastro Alvarenga - 0,22 ha;Centro;CP;2004
Perdões;Obelisco da Praça 1º de Junho – Monumento em Homenagem ao ex-Combatente 2ª Guerra;Praça 1º de Julho - Centro;BI;2004
Perdões;Estação Ferroviária - Atual Casa de Cultura;Praça Fernando de Oliveira, nº98;BI;2004
Perdões;Igreja Nossa Senhora do Rosário;Praça José Modesto Sobrinho,s/nº;BI;2004
Perdões;1ª Prefeitura de Perdões – atual Biblioteca;Praça Manoel Domingues de Sá Fortes, nº04;BI;2004
Perdões;Santa Casa de Misericórdia;Praça Otávio Alvarenga;BI;2004
Perdões;Igreja Matriz Senhor Bom Jesus dos Perdões;Praça Zoroastro Alvarenga, s/nº;BI;2004
Perdões;Grupo Escolar Otaviano Alvarenga;Rua Coronel Joaquim Francicsco,nº 38;BI;2004
Perdões;1º Fórum de Perdões – atual Museu e Estação de Rádio;Rua Sá Fortes, nº 55;BI;2004
Piau;Prefeitura Municipal;Rua Silva Jardim  nº 67 - Centro;BI;2023
Piau;Pintura Parietal na Prefeitura Municipal;Rua Silva Jardim  nº 67 - Centro;BM;2012
Piau;Prefeitura Municipal de Piau;Rua Silva Jardim, nº 67 - Centro;BI;2023
Piau;Busto de Joaquim Marciano Loures;Não informado;BI;2004
Piedade de Caratinga;Imagem de Nossa Senhora da Piedade;Não informado;BM;2012
Piedade de Caratinga;Conjunto Paisagístico da Praça Adriano Sabino - < 2 ha;Não informado;CP;2014
Piedade de Ponte nova;Escola Estadual Coronel Antoninho;Não informado;BI;2003
Piedade de Ponte nova;Imagem de Nossa Senhora Piedade;Não informado;BM;2003
Piedade de Ponte nova;Parque Municipal de Piedade - 9,67 ha;Não informado;CP;2004
Piedade do Rio Grande;Núcleo Histórico do Povoado de Santo Antônio do Porto - 80 unidades;Distrito de Santo Antônio do Porto - Estrada sentido Santana do Garambéu;NH;2019
Piedade do Rio Grande;Imagem de Nossa Senhora do Rosário;Praça Salvador Lourenço, s/nº;BM;2012
Piedade dos Gerais;Casa da Fazenda do Andrade - Cambui;Comunidade de Cambuí;BI;2006
Piedade dos Gerais;Casa da Fazenda Grota dos Pinheiros;Comunidade de Egito;BI;2006
Piedade dos Gerais;Fazenda Retiro - A;Comunidade Retiro;BI;2006
Piedade dos Gerais;Fazenda Mata Boi;Povoado Casa Branca;BI;2007
Piedade dos Gerais;Fazenda Macaúbas;Povoado de Macaúbas;BI;2006
Piedade dos Gerais;Ruínas da Capela de Nossa Senhora do Rosário;Rua Nossa Senhora do Bonfim nº 872 - Centro;BI;2003
Piedade dos Gerais;Instrumentos da Corporação Musical de Piedade das Gerais;Rua Presidente Vargas nº 35 - Centro;BM;2003
Piedade dos Gerais;Fazenda Retiro -  B;Não informado;BI;2006
Piedade dos Gerais;Cachoeira do Encontro - 19,625 ha;Não informado;CP;2006
Piedade dos Gerais;Cachoeira do Vento - 19,625 ha;Não informado;CP;2006
Piedade dos Gerais;Cachoeira dos Pássaros - 19,625 ha;Não informado;CP;2006
Pimenta;Casa Distribuidora - Atual Casa do Turista de Pimenta;Avenida Jair Leite, nº337 - Centro;BI;2022
Pimenta;Acervo de Livros Históricos do Século XX;Prefeitura Municipal - Avenida JK, nº396;BM;2021
Pingo D'Agua;Imagem Sacra de São Sebastião;Igreja Matriz de São Sebastião - Rua Creuza Ferreira Duarte, nº 50 - Bairro São Sebastião;BM;2025
Piracema;Conjunto Paisagístico Praça José Ribeiro de Assis - 0,1824 ha;Praça José Ribeiro de Assis;CP;2006
Piracema;Imagem de Nossa Senhora das Necessidades;Igreja Matriz de Nossa Senhora das Necessidades, Praça Manoel Sampaio s/nº - Centro;BM;2013
Pirajuba;Capela Santa Terezinha;Não informado;BI;2009
Piranga;Núcleo Hisstórico e Urbano de Pinheiros Altos - 100 unidades;Distrito de Pinheiros Altos;NH;2011
Piranga;Núcleo Histórico Urbanístico de Santo Antônio do Pirapetinga - 52 unidades;Distrito de Pinheiros Altos;NH;2007
Piranga;Conjunto Natural e Paisagístico da Fazenda Praia Grande - 100 ha;Fazenda Praia Grande - Distrito de Pinheiros Altos;CP;2012
Piranga;Câmara Municipal;Praça Coronel Amarantino, nº10 - Centro;BI;2012
Piranga;Igreja Nossa Senhora da Conceição;Praça Nossa Senhora da Conceição, s/nº - Povoado de Pinheiros Altos;BI;2008
Piranga;Igreja Nossa Senhora do Rosário - Pinheiros Altos;Praça Nossa Senhora do Rosário, s/nº - Povoado de Pinheiros Altos;BI;2008
Piranga;Prefeitura Municipal;Rua Benedito Valadares, nº09 - Centro;BI;2012
Piranga;Casarão do Rosário;Rua José Chassin, s/nº;BI;2007
Piranga;Igreja Nossa Senhora da Boa Morte;Rua Vereadora Maria Anselma,s/nº - Centro;BI;2009
Piranga;Imagem do Senhor Bom Jesus do Matozinhos;Santuário do Senhor Bom Jesus do Matozinhos, s/nº - Santo Antônio do Pirapetinga;BM;2007
Piranguçu;Edificação;Rua José Maria da Silveira Campos, nº116, Centro;BI;2025
Piranguçu;Imagens de Nossa Senhora de Lourdes e de Santa Bernadete;Gruta de Nossa Senhora de Lourdes e Santa Bernadete - Rua Inácio Leme,s/nº-  Bairro Centro;BM;2025
Piranguinho;Ginásio Poliesportivo João José dos Reis - Reizão;Rua Gregório Mota s/nº;BI;2025
Piranguinho;Estação Ferroviária;Avenida Sebastião Pereira Machado,s/nº;BI;2021
Piranguinho;Ponte Governador Valadares;Rua Flauzina da Costa, s/nº - Distrito de Olegário Maciel;BI;2022
Piranguinho;Paço Municipal;Edificação na Avenida Alferes Renó, nº200, Centro;BI;2024
Piranguinho;Imagem de São Benedito;Praça Coronel Braz, Igreja Matriz de Santa Isabel, Distrito Sede;BM;2024
Piranguinho;Capela Nossa Senhora do Carmo - Capote;Não informado;BI;2009
Piranguinho;Estação Ferroviária de Olegário Maciel;Não informado;BI;2007
Piranguinho;Ponte de ferro sobre o Rio Sapucaí - não existe mais esse bem cultrural;Não informado;BI;2003
Piranguinho;Imagem de Santa Isabel de Portugal;Não informado;BM;2003
Piranguinho;Conjunto Paisagístico da Mata do Cruzeiro - 20,77 ha;Não informado;CP;2010
Pirapetinga;Praça Santana - 0,348 ha;Ruas José Ferreira de Souza, Hamilton Martins e Bento Martins;BI;2025
Pirapetinga;Plataforma Parada Doutor Junqueira;Estrada  Rural da 'Parada', Zona  Rural do Distrito Sede;BI;2025
Pirapetinga;Estação Caiapó;Praça Major Afonso s/nº - Distrito de Caiapó;BI;2025
Pirapora;Antiga Estação Ferroviária;Não informado;BI;2012
Pirapora;Banco do Comércio;Não informado;BI;2011
Pirapora;Casa Doutor Camillo José dos Santos;Não informado;BI;2012
Pirapora;Casa Salomão Abdalla;Não informado;BI;2012
Pirapora;Escola Estadual Fernão Dias;Não informado;BI;2012
Pirapora;Gráfica Veredas;Não informado;BI;2011
Pirapora;Sobrado Tiburtino;Não informado;BI;2012
Pirapora;Conjunto de Instrumentos Musicais;Não informado;BM;2009
Pirapora;Vapor Benjamim Guimarães;Não informado;BM;2010
Pirapora;Complexo portuário da navegação do Rio São Francisco - 13,1 ha;Não informado;CP;2010
Piraúba;Antiga Estação Ferroviária e Armazém;Não informado;BI;2013
Piraúba;Grupo Escolar Dona Maria Duarte Braga;Não informado;BI;2010
Piraúba;Conjunto de Instrumentos Musicais;Não informado;BM;2008
Piraúba;Praça Guarurama - 0,4 ha;Não informado;CP;2010
Pitangui;Imagem de Nossa Senhora das Dores;Acervo do Instituto Histórico de Pitangui - IHP;BM;2023
Pitangui;Chafariz;Praça Getúlio Vargas;BI;2006
