cidade;denominacao_do_bem_tombado;endereco;tipo;ano_de_tombamento
Campo do Meio;Praça Coronel José Baptista da Rocha;Ruas Armando de Paula Meimberg, Adolfo José da Rocha, Antônio Marques do Nascimento, José Henrique Silvério;CP;2026
Campo do Meio;Imagem de Nossa Senhora Aparecida;Rua Monsenhor José Lourenço Leite nº 825 – Bairro Padre Chico;BM;2022
Campo Florido;Conjunto Paisagístico da Fazenda Nova Santo Inácio Ranchinho;Nova Fazenda Santo Inácio Ranchinho;CP;2024
Campo Florido;Departamento de Educação e Cultura - Antiga Prefeitura Municipal;Rua Alfredo de Paula nº 18 - Centro;BI;
Campo Florido;Tambores de Percussão da Folia da Reis de Campo Florido;;BM;2024
Campos Altos;Capela de Nossa Senhora Aparecida - Primeira Capela Construida em 1951;Complexo do Segundo Santuário da Aparecida;BI;
Campos Altos;Imagem de São Jerônimo;Igreja do Distrito de São Jerônimo dos Poções;BM;2012
Campos Altos;Estação Ferroviária de Campos Altos;Praça Benedito Valadares nº 75 - Centro;BI;2006
Campos Altos;Residência Família Franco;Rua Cornélia Alves Bicalho nº 253 – Centro;BI;2022
Campos Altos;Capela Nossa Senhora Aparecida;Segundo Santuário de Nossa Senhora da Aparecida;BI;
Campos Altos;Conjunto Arquitetônico e Paisagístico do Santuário Nossa Senhora Aparecida;Via de acesso à BR 262;CP;2012
Campos Gerais;Ponte das Amoras - Liga Campos Gerais a Alfenas;Rodovia BR 369 - KM 89;BI;2025/2026
Campos Gerais;Parque Aquático e Turístico Vale dos Ipês;"BR 369 (sentido Boa Esperança – Campos Gerais) – Avenida Davi Pereira Maia -  (21°14'23.6""S 45°45'01.1""W)";CP;2025
Campos Gerais;Têmpera sobre tela - Paixão de Cristo;Secretaria de Cultura – Prefeitura Municipal – Rua Nossa Senhora do Carmo nº 131;BM;2009
Campos Gerais;Passinho;Rua Nossa Senhora do Carmo  s/n°;BI;2009
Campos Gerais;Monumento da Ferradura em Homenagem a Nossa Senhora Aparecida;Parque de Exposições José Júlio Coelho - Avenida Davi Pereira Maia s/nº - BR-369;BI;2026
Cana Verde;Conjunto Paisagístico Praça Nemésio Monteiro;Rua José Túlio  nº 87-  - Centro;CP;2025
Cana Verde;Conjunto Arquitetônico e Paisagístico das praças Governador Magalhães Pinto e Cristóvão Cipriano Carneiro;"Praça Governador Magalhães Pinto e Praça Cristovão Cipriano Carneiro; Rua José Alves; Rua José Júlio; Rua Calipso Augusto Da Silva; Rua José Augusto Miranda; Rua Antônio Bastos; Av. Carmelita Carvalho Garcia; Rua Isolina Cardoso";CP;2009
Cana Verde;Conjunto Paisagístico Praça Nemésio Monteiro;;CP;
Cana Verde;Imagem do Senhor Bom Jesus de Matozinhos;Parque do Senhor Bom Jesus de Matozinhos;BM;2010
Cana Verde;Capela Nossa Senhora  Aparecida;Praça Antônio Joaquim Gonzaga - Povoado de Cerradinho;BI;2011
Cana Verde;Solar dos Barbosa e Castro;Praça Cristovão Cipriano Carneiro nº 175 - Centro;BI;2009
Cana Verde;Casarão da Tia Rosa;Praça Cristovão Cipriano Carneiro nº 125;BI;2010
Cana Verde;Igreja Matriz do Senhor Bom Jesus de Matozinhos;Praça Governador Magalhães Pinto;BI;2010
Cana Verde;Capela Nossa Senhora do Rosário;Praça nemésio Monteiro - Centro;BI;2011
Cana Verde;Pontilhão de Ferro;Rio Jacaré;BI;2010
Canaã;Cruzeiro;Rua Bela Vista  s/n° - Centro;BI;2010
Canaã;Fazenda Cascatinha;;BI;
Canaã;Fazenda de Lajinha;;BI;
Canaã;Fazenda da Lage;;BI;
Canápolis;Conjunto Paisagístico da Cachoeira Córrego do Cerrado;Avenida da Saudade  nº 296;CP;2010
Canápolis;Quadro do fundador de Canápolis - Coronel José de Paula Gouveia;Antigo Fórum e Prefeitura- Atual Casa de Cultura - Rua 08 nº 366 - Centro;BM;2007
Canápolis;Casa de Cultura - Antigo Fórum e Prefeitura;Rua 08 nº 366 - Centro;BI;2008
Candeias;Igreja e Santuário Senhor Jesus de Matozinhos;Avenida 17 de dezembro - Centro;BI;2008
Candeias;Circulo Operário São José - Antigo Cinema;Avenida 17 de dezembro  nº 225 - Centro;BI;2008
Candeias;Praça Monsenhor Joaquim de Castro;"Ruas Salatiel Carvalho; Avenida 17 de Dezembro; Vereador José Hilario da Silva; Vereador Sidney Galdino; Francisco Teixeira; Vereador João Sidney Souza; Padre Dionizio e Conego Domingos";CP;2008
Candeias;Igreja São Sebastião;Comunidade Rural dos Vieiras;BI;2008
Candeias;Imagem do Bom Jesus de Matosinhos;Igreja e Santuário do Senhor Bom Jesus, Praça Monsenhor Castro s/nº;BM;2024
Candeias;Imagem Nossa Senhora das Dores;Igreja e Santuário do Senhor Bom Jesus - Praça Monsenhor castro s/ nº;BM;2024
Candeias;Imagem Senhor dos Passos;Igreja e Santuário do Senhor Bom Jesus - Praça Monsenhor castro s/ nº;BM;2024
Candeias;Imagem de Nossa Senhora das Candeias;Igreja Matriz Nossa Senhora  das Candeias;BM;2008
Candeias;Imagem Sagrado Coração de Jesus;Igreja Matriz Nossa Senhora das Candeias - Praça Monsenhor Castro nº 300;BM;2024
Candeias;Estação Ferroviária;Praça Getúlio Vargas   nº 97 - Estação Candeias;BI;2008
Candeias;Cruzeiro da Praça Marechal Deodoro do Alto do Cruzeiro;Praça Marechal Deodoro;BM;2024
Candeias;Igreja Matriz Nossa Senhora das Candeias;Praça Monsenhor Castro  s/n° - Centro;BI;2008
Candeias;Igreja do Alto do Mingote;Rua Turmalina  s/n° - Bairro Fernandes II;BI;2008
Cantagalo;Imagem de Nossa Senhora da Conceição;Igreja Matriz Nossa Senhora da Conceição - Praça Simão da Cunha  s/n° - Centro;BM;2011
Cantagalo;Igreja Matriz Nossa Senhora da Conceição;Praça Simão da Cunha  s/n° - Centro;BI;
Caparaó;Antiga Estação Ferroviária de Caparaó;Avenida Américo Vespúcio de Carvalho nº 170 - Centro;BI;2023
Capela nova;Imagem de Nossa Senhora das Dores - Padroeira;Matriz Nossa Senhora das Dores - Praça Senhora das Dores  s/n°;BM;2005
Capela nova;Fonte da Pedra;Rua Fonte da Pedra  s/n°;BI;2005
Capela nova;Conjunto Paisagístico Praça Nossa Senhora das Dores;Ruas Cônego José A. Henriques, Sinhazinha Pereira, Lopes Assis e Prefeito Anísio Lopes Assis.;CP;2015
Capelinha;Imagem de Nossa Senhora da Graça;Igreja  Matriz da Paróquia de Nossa Senhora da Graça - Rua Doutor Hermelindo  s/n° - Centro;BM;2009
Capelinha;Chalet do fim do século;Rua das Flores   nº 636 - Centro;BI;2005
Capim Branco;Casarão Inhô Cachimbo;Avenida Coronel Custódio Alvarenga  n° 95 - Centro;BI;
Capim Branco;Cruzeiro do Barão;Rua Maria Ribeiro dos Santos  s/nº - Bairro Planalto;BI;2012
Capim Branco;Corporação Musical Nossa Senhora da Conceição de Capim Branco;Rua Antônio Dias Magalhães  nº 10 - Centro;BI;2011
Capim Branco;Praça da Igreja Matriz Nossa Senhora da Conceição;Ruas Professor Lúcio Teodoro Flores, Geraldo Corrêa, Padre Estevão e Santos V. Andrade;CP;2026
Capinópolis;Praça João Moreira de Souza;Entre as ruas 102 e 104 e entre as avenidas 109 e 111 - Bairro Boa Vista;CP;2026
Capinópolis;Casarão do Fundador da cidade de Canápolis Senhor Jerônimo Maximiano da Silva;Fazenda Ideal;BI;2013
Capinópolis;Serrinha;-18.690027, -49.582674;CP;2026
Capitão Andrade;Capela Nossa Senhora das Graças - Capela Maria Teófila;Córrego da Perdida;BI;2012
Capitólio;Conjunto do Tear;Rua Doutor Avelino Queiroz n° 514 e Rua João Braz Pereira  nº 52;BM;2004
Capitólio;Sociedade São Vicente de Paulo;Rua Doutor Avelino Queiroz n° 514;BI;2004
Caputira;Conjunto Paisagístico Praça Padre Joaquim de Castro;Ruas A, B, Largo da Matriz e Avenida Manoel Francisco de Freitas;CP;2010
Caputira;Acevo de instrumentos da Corporação Musical Campo Florido;Praça Padre Joaquim da Costa s/nº;BM;2008
Caranaíba;Imagem de Nossa Senhora da Glória;Igreja Matriz de Nossa Senhora da Glória - Praça da Matriz  s/n°;BM;2007
Caranaíba;Igreja de Nossa Senhora da Glória;Praça da Matriz  s/n°;BI;
Caranaíba;Antiga  Prefeitura Municipal;Praça Marciano Vieira nº 15 - Centro;BI;
Carandaí;Pontilhão da Rede Ferroviária Federal;;BI;
Carandaí;Imagem de Nossa Senhora da Glória;Igreja de Nossa Senhorada Glória - Distrito de Hermilo Alves - Povoado de Ressaca;BM;2007
Carandaí;Estação Ferroviária;Rua Major João Rocha  s/n° - Centro;BI;2009
Carandaí;Igreja de Nossa Senhora Mãe dos Homens;Comunidade de Bom Jardim;BI;2009
Carangola;Praça Coronel Maximiano;;CP;2007
Carangola;Igreja Sagrado Coração de Jesus;Comunidade de Parada General;BI;2009
Carangola;Igreja São Manoel do Boi;Comunidade de São Manoel do Boi;BI;2001
Carangola;Sítio Arqueológico;Fazenda São Januário - Córrego do Retiro - Distrito de Ponte Alta;CP;2003
Carangola;Cruzeiro;Morro do Cruzeiro;BI;2007
Carangola;Imagem de São Geraldo;Rua Antônio Marques nº 231 - Centro;BM;2009
Carangola;Igreja Matriz de Santa Luzia;Praça Coronel Maximiano nº 138;BI;
Carangola;Fórum de Justiça Doutor Xenofonte Mercadante;Praça Coronel Maximiano nº 56;BI;2001
Carangola;Prefeitura Municipal;Praça Coronel Maximiano nº 88 - Centro;BI;
Carangola;Faculdade de Filosofia, Ciências e Letras - FAFILE;Praça dos Estudantes nº 23 - Bairro Santa Emília;BI;2007
Carangola;Estação Rodoviária Wingdston Mendes de Souza;Praça Getúlio Vargas nº 87 - Centro;BI;2001
Carangola;Igreja Nossa Senhora do Rosário;Praça Governador Valadares  s/n°;BI;
Carangola;Coreto de Alvorada;Praça nascimento Leal - Distrito de Alvorada;BI;2007
Carangola;Pontilhão de Ferro;Rua Amilcar de Souza com Rua Justino Frossard;BI;2001/2007
Carangola;Estação Ferroviária;Rua Antônio Marques - Centro;BI;2007
Carangola;Escola Estadual Melo Viana;Rua Doutor Duque de Mesquita nº 252 - Centro;BI;2008
Carangola;Escola Servita Regina Pacis;Rua Doutor Olímpio Teixeira nº 243 - Centro;BI;2007
Carangola;Sociedade Beneficente Lyra 21 de Abril;Rua Santa Luzia nº 540 - Bairro Largo do Rosário;BI;2012
Carangola;Residência da Família Eisenlohr Andrade;Rua Santos Dumont nº 274 - Bairro Largo do Rosário;BI;2012
Carangola;Estádio Roseny Soares: fachada;Praça Rotary s/nº - Bairro Santa Emília;BI;2012
Carangola;Igreja Nossa Senhora da Glória;;BI;
Caratinga;Edificação;Avenida João Pinheiro nº 154 - Centro;BI;2011
Caratinga;Vitral das Carmelitas;Avenida Monsenhor Aristides Rocha nº 02 – KM 523/BR116 – Bairro Nossa Senhora das Graças;BM;2017
Caratinga;Conjunto Arquitetônico e Urbanístico da Praça Cesário Alvim: Escola Princesa Isabel, fachada do Palácio do Bispo, Coreto Ronaldo Oliveira da Silva Araújo, Catedral de São João Batista e a Praça Cesário Alvim;;CP;2003
Caratinga;Escola Estadual Princesa Isabel;Praça Cesário Alvim nº 55;BI;
Caratinga;Secretaria Municipal de Ação Social - Antiga Estação Ferroviária;Praça Coronel Rafael Silva Araújo  s/n°;BI;2009
Caratinga;Fórum Desembardagor Faria e Souza;Praça Getúlio Cargas nº 40 – Centro;BI;
Caratinga;Estação Ferroviária de Dom Lara;Praça José Cardoso de Paiva  s/nº - Distrito de Dom Lara;BI;2011
Caratinga;Igrejinha de São João;Rua Major Carlos Teixeira  s/nº;BI;2011
Caratinga;Monumento Menino Maluquinho;Praça Manoel Ribeiro Sobrinho - às margens da BR 116 e Avenida Presidente Tancredo neves;BIntegrado;2026
Carbonita;Sobrado de Eva Duarte;Fazenda Gangorras - Comunidade de Bernardos;BI;
Carbonita;Igreja Sagrado Coração de Jesus;Praça Edgar Miranda nº 02 - Centro;BI;2011
Carlos Chagas;Biblioteca Pública Municipal Tancredo Neves;Rua Major João Gomes Euzébio nº 376;BI;2025
Carlos Chagas;Imagem do Senhor Morto;Sacristia da Igreja Matriz de São Sebastião - Praça Getúlio Vargas nº 14 – Centro;BM;2025
Carlos Chagas;Imagem de Nossa Senhora das Dores da Colônia Epaminindas Otoni;Igreja de de Nossa Senhora  das Dores - Distrito de Epaminondas Otoni;BM;
Carlos Chagas;Estação Ferroviária da Estrada de Ferro Bahia Minas;Praça Voquinha s/nº -  Povoado Francisco de Sá;BI;2024
Carlos Chagas;Igreja de Nossa Senhora da Penha;Rua Vicente Alves nº 109 - Povoado de Mayrink;BI;2024
Carmésia;Igreja Matriz de Nossa Senhora  do Carmo;Praça Nossa Senhora  do Carmo  s/n° - Centro;BI;2008
Carmésia;Violino Stradivarius;Rua Furbanoino José Soares nº 254 - Centro;BM;2008
Carmo da Cachoeira;Estação Ferroviária de Carmo da Cachoeira;Trevo com a Rodovia Fernão Dias - BR 381 - Bairro Estação;BI;2007
Carmo da Cachoeira;Capela de Santo Antônio;Avenida Paulo Reis Veiga Lima s/nº - Bairro Estação;BI;2009
Carmo da Cachoeira;Imagem de Santo Antônio;Capela de Santo Antônio - Bairro Estação;BM;2009
Carmo da Cachoeira;Praça Nossa Senhora  do Carmo;Ruas Doutor Veiga Lima, Dom Inocêncio, Arthur Tiburcio e Antonio Justiniano;CP;2009
Carmo da Mata;Grupo Escolar Silviano Brandão;Avenida Dom Alexandre Amaral nº 53;BI;2003
Carmo da Mata;Imagem de Sant'Ana;Capela da São Sebastião do Quilombo - Povoado do Quilombo;BM;2003
Carmo da Mata;Conjunto Paisagístico da Cachoeira da Forquilha;;CP;2026
Carmo de Minas;Estação Ferroviária de Carmo de Minas;Praça Guedes Fernandes s/nº - Centro;BI;2025
Carmo de Minas;Praça Deputado Doutor José Ferraz Caldas;Entre o adro da Igreja Matriz de Nossa Senhora  do Carmo e as ruas Padre Cardoso, Dona Ana Umbelina e Presidente Getúlio Vargas - Centro;CP;2012
Carmo de Minas;Conjunto de Quadros da Via Sacra - Quadros I a XIII;Matriz Nossa Senhora  do Carmo - Praça Deputado Doutor José Ferraz Caldas;BM;2007
Carmo de Minas;Coreto do Chico Cascateiro;Praça Deputado Doutor José Ferraz Caldas s/nº - Centro;BI;2007
Carmo de Minas;Antiga Pharmacia Nossa Senhora do Carmo;Rua Maria Franqueira nº 58;BI;2026
Carmo do Cajuru;BIblioteca Pública MunicIpal José Donisete Ribeiro Souza - Primeira Prefeitura;Praça 1º de janeiro nº 78;BI;2020
Carmo do Cajuru;Capela de São José;Praça Maria Coladina -Distrito de São José dos Salgados;BI;2024
Carmo do Cajuru;Igreja de Nossa Senhora do Rosário;Praça Primeiro de Janeiro, s/nº - Centro;BI;2020
Carmo do Cajuru;Antiga residência do Senhor Godofredo Passos;Rua Aquiles Guimarães nº 33 - Centro;BI;2022
Carmo do Cajuru;Casa Verde - Antiga residência de Antônio Miguel Maia;Rua Aquiles Guimarães n° 269 - Centro;BI;2023
Carmo do Cajuru;Cemitério Municipal - Cemitério do Bonfim;Rua Cinco, s/nº - Bairro Bonfim;BI;2024
Carmo do Cajuru;Residência da Senhora Clarinda Quadros Batista;Rua Gonçalves Chaves nº 130 - Centro;BI;2022
Carmo do Cajuru;Escola Municipal Princesa Isabel;Rua Rui Barbosa nº 117 - Centro;BI;2022
Carmo do Cajuru;Conjunto Paisagístico da Praça Sagrado Coração de Jesus;Distrito de Ribeiros;CP;2025/2026
Carmo do Cajuru;Antigo Fórum;Rua Tiradentes nº 02 - Centro;BI;2024
Carmo do Cajuru;Missale Romanum - 1818;Museu da Paroquia de Nossa Senhora  do Carmo -Rua Presidente Tancredo Neves nº 11 - Centro;BM;2005
Carmo do Cajuru;Igreja Matriz de Nossa Senhora  do Carmo;Praça Vigário José Alexandre Mendonça nº 103 - Centro;BI;2004
Carmo do Cajuru;Antiga Casa Paroquial;Rua Gonçalves Chaves nº 201 – Centro;BI;2022
Carmo do Cajuru;Cemitério dos Escravos;Comunidade de Marimbondos;BI;2026
Carmo do Paranaíba;Capela Santa Cruz do Monte;Avenida  Santa Cruz s/nº - Bairro Santa Cruz;BI;2012
Carmo do Paranaíba;Imagem de Nosso Senhor Morto;Igreja Matriz de Nossa Senhora  do Carmo - Rua Bonfim nº 02 - Parque Taboão;BM;2013
Carmo do Paranaíba;Igreja Nossa Senhora do Rosário;Praça Nossa Senhora do Rosário s/nº - Bairro Rosário;BI;2023
Carmo do Paranaíba;Calçada de Pedra da Fonte do Mandioca;Inicia perpendicularmente à Rua Padre Manoel e termina às margens do Córrego Taboão;CP;2013
Carmo do Rio Claro;Capela Nosso Senhor dos Passos;Rua Monsenhor Mário  s/nº - Praça Irmãos de São Gabriel - Centro;BI;2018
Carmo do Rio Claro;Imagem Nosso Senhor dos Passos;Capela de nosso Senhor dos Passos - Rua Monsenhor Mário  s/n° - Centro;BM;2008
Carmo do Rio Claro;Imagem de Nossa Senhora  das Dores;Igreja Nossa Senhora do Rosário - Praça Nossa Senhora do Rosário s/nº- Bairro Rosário;BM;2018
Carmo do Rio Claro;Conjunto Paisagísitico da Serra da Tormenta;;CP;2018
Carmo do Rio Claro;Núcleo Histórico de Carmo do Rio Claro;;NH;
Carmópolis de Minas;Memorial do Rosário;Cardeal Dom Lucas Moreira Neves -  Antiga  Praça do Rosário - Centro;BI;2023
Carmópolis de Minas;Praça Nossa Senhora do Carmo;Rua Walter Castro - Avenida Dom Alexandre Gonçalves do Amaral e Avenida Américo Paulinelli - via em frente da Matriz Nossa do Carmo;CP;2023
Carmópolis de Minas;Igreja Matriz Nossa Senhora do Carmo;Praça Nossa Senhora do Carmo - Centro;BI;2023
Carmópolis de Minas;Escola Municipal Américo Leite;Praça Senhor dos Passos nº 33 - Centro;BI;2022
Carmópolis de Minas;Núcleo Integrado da Saúde da Mulher e da Criança Carlos Vicente Lara;Rua Maria Cirilo nº 476 - Centro;BI;
Carneirinho;Museu Emídio José do Socorro;Rua Antônio das Graças Oliveira nº 400 – Centro;BI;2019
Carrancas;Conjunto Paisagístico do Sítio Arqueológico das Escrituras Rupestres do Complexo da Zilda;Fazenda Boa Vista - Estrada de Carrancas ao Complexo da Zilda - Cachoeira dos Índios – Km 12 - Latitude: 21°33’28.37” S // Longitude: 44°38’13.04” W;CP;2016
Carrancas;Igreja Matriz de Nossa Senhora da Conceição de Carrancas;Praça Manoel Moreira s/nº - Centro;BI;2023
Carrancas;Capela de Nossa Senhora do Porto do Saco - Capela do Saco;Rua 05  s/nº- Bairro  - Centro - Povoado do Porto do Saco - Latitude: -21°20’29.3” S // Longitude: -44°32’.00” W;BI;2008
Carrancas;Quadro a óleo sobre tela - Vista da Cidade de Carrancas;Prefeitura - Rua Padre Toledo Taques nº 235 - Centro;BM;2019
Carvalhópolis;Residência Caproni;Estrada para o Bairro Macacos - Km 3,5;BI;2015
Carvalhópolis;Árvore da espécie Copaíba;Praça Monsenhor Dutra - Centro;BI;Destruída em 2009
Carvalhópolis;Praça Monsenhor Dutra;;CP;2018
Carvalhópolis;Imagem São Sebastião;Acervo da Igreja Matriz de São Sebastião  - Praça Monsenhor Dutra  s/n° - Centro;BM;2012
Carvalhópolis;Parque Municipal Dona Jandira;Rua José Benedito de Almeida s/º - Centro;CP;
Carvalhos;Imagem de São Lázaro;Igreja de São Lázaro - Povoado de Muquém;BM;2019
Carvalhos;Imagem do Sagrado Coração de Jesus;Igreja Matriz do Sagrado Coração de Jesus - Avenida do Sagrado Coração de Jesus  s/n° - Praça Padre José Ferreira Leite;BM;2018
Carvalhos;Estação Ferroviária de Carvalhos;Praça Ibraim Pereira da Cunha, s/n°;BI;2024
Carvalhos;Igreja Matriz do Sagrado Coração de Jesus;Praça José Ferreira Leite nº 22 - Centro;BI;2024
Carvalhos;Igreja de Nossa Senhora Aparecida;Rua Nossa Senhora Aparecida nº 16 - Centro;BI;2024
Carvalhos;Conjunto Arquitetônico e Paisagístico da Antiga Rede Mineira de Viação - Antiga Estação Ferroviária de Carvalhos;"Rua Sofia Fernandes, Avenida Esdraz Tomas Salvador, Alameda das Palmeiras, Rua Avelino Carvalhos, Rua José Domingues Amaral; Praça Ibraim Pereira Cunha";CP;2024
Casa Grande;Fazenda do Retiro: Sede;Distrito de Córrego Fundo;BI;2008
Casa Grande;Cadastro de Escravos;Fazenda do Retiro - Córrego Fundo;BM;2007
Casa Grande;Conjunto Paisagístico da Pedra do Urubu, Gruta do Morcego e Barragem  D’Água - Carapuça;;CP;2010
Cascalho Rico;Conjunto Paisagístico Praça São João Batista;;CP;
Cascalho Rico;Instrumentos Musicais da Banda Municipal Alício Miranda;Clube Reviver - Rua Vereador Leônidas Batista Machado  s/n°;BM;
Cascalho Rico;Imagem de São João Batista;Igreja de São João Batista - Praça São João Batista s/nº;BM;
Cascalho Rico;Chafariz;Praça São João Batista;BI;
Cascalho Rico;Casa do Senhor Aureliano;Praça São João Batista nº 96;BI;2010
Cássia;Santuário de Santa Rita de Cássia;Praça Barão de Cambuí s/nº – Centro;BI;2020
Cássia;Rádio Cultura de Cássia;Praça Daniel Puntel nº 56;BI;2009
Cássia;Acervo do Jornal A Vanguarda;Casa de Cultura - Rua Aviador Azevedo Borges nº 121 – Centro;BM;2020
Cássia;Casa de Cultura;Rua Aviador Azevedo Borges nº 121 – Centro;BI;2009
Cataguases;Edificação;Praça Governador Valadares nº 189/195/197;BI;
Cataguases;Escola Estadual Coronel Vieira;Avenida Astolfo Dutra nº303;BI;
Cataguases;Estação Ferroviária;Avenida Manoel Inácio Peixoto nº 370 - Distrito de Sereno;BI;
Cataguases;Escola Estadual Manoel Inácio Peixoto - Colégio Cataguases;Chácara da Granjaria;BI;
Cataguases;Ponte Metálica sobre o Rio Pomba RFFSA;Estrada de Aracati de Minas e Vista Alegre;BI;
Cataguases;Estação Ferroviária;Fazenda Sinimbú;BI;
Cataguases;Ponte Metálica sobre o Rio Pomba;Final da Rua Doutor Francisco de Barros - Interliga as duas margens pela Rua Doutor Francisco de Barros;BI;
Cataguases;Malha Ferroviária com seus trilhos e dormentes - Estrada de Ferro Leopoldina RFFSA;Localizda na estrada entre Aracati de Minas e Vista Alegre;BI;
Cataguases;Chácara Dona Catarina - Museu;Praça Chácara Dona Catarina nº 176;BI;
Cataguases;Companhia Brasileira de Alimentos – COBAL;Praça Governador Valadares nº 189;BI;
Cataguases;Cine Edgard;Praça Rui Barbosa nº 174 - Centro;BI;
Cataguases;Santuário Diocesano de Santa Rita de Cássia;Praça Santa Rita de Cássia nº 92;BI;
Cataguases;Paço Municipal;Praça Santa Rita nº 462;BI;
Cataguases;Ponte Metálica sobre o Rio Pomba;Rua Floriano Peixoto - Distrito de Vista Alegre;BI;
Cataguases;Delegacia de Polícia: Fachada;Rua Major Vieira nº 324 - Antiga Rua Tenente Fortunato;BI;
Cataguases;Estação Ferroviária - Estação de Trem Glória de Cataguases - Museu Ferroviário;Rua Manoel Quintiliano Guieiro - Distrito de Glória dos Cataguases;BI;
Cataguases;Estação Ecológica de Água Limpa;Rua Nossa Senhora das Graças nº 1927 - Granjaria;BI;
Cataguases;Estação Ferroviária - Antiga Estação Ferroviária de Aracaty;Rua Pastor Ferreira nº 210 - Distrito de Aracati de Minas;BI;
Cataguases;Escola Estadual Guido Marliére;Rua Tenente Luis Ribeiro nº 110;BI;
Cataguases;Antiga Estação Ferroviária;Rua Visconde do Rio Branco nº 170 - Centro;BI;
Cataguases;Monumento a José Inácio Peixoto;Praça José Inácio Peixoto  - Vila Tereza;CP;
Catas Altas;Núcleo Histórico;Compreende as praças: Monsenhor Mendes,  São Miguel e Santa Quitéria: as ruas Monsenhor Barros, Nossa Senhora do Rosário, Joaquim José Loureiro, José Tomé, São Benedito, Santo Onofre, Padre José Emílio Veiga, Santa Efigênia, Beco da Maricota, Ladeira e entorno Santa Quitéria, Rua Outra Banda até o nº 330, Beco do Santíssimo até o seu córrego, Rua São Bento Alexandre até o nº 54, Rua São Miguel até o seu córrego, Rua Nossa Senhora do Carmo até o nº 51, Rua do Bonfim até o seu córrego, Rua da Praia à sua direita  esquina com Rua Santo Onofre e à sua esquerda até o córrego, Rua Juca Alves até o seu córrego, Rua José Augusto de Souza até o nº 60, Rua Augusto Franklin Pereira até o seu córrego, Rua Melquíades Leandro Rodrigues até o nº 625, Rua Santa Quitéria até esquina com a ladeira de Santa Quitéria. As seguintes Ruas até 50m de sua extensão sendo: Rua Olinto Viegas, Rua José Bernardo de Magalhães, Rua Francisco Rodrigues e Rua Maquiné.;NH;2000
Catas Altas;Praça Raymundo Gonçalves Viegas - Antiga Praça São Miguel;Entre as Ruas São Miguel e Joaquim Loureiro - Centro;CP;2004
Catas Altas;Igreja de Nossa Senhora Mãe dos Homens;Estrada do Caraça, km 9 –  RPPN do Santuário do Caraça;BI;2024
Catas Altas;Conjunto Arquitetônico e Paisagístico da Ponte dos Perdões;Estrada vicinal do município sobre o Ribeirão Coqueiros;CP;2003
Catas Altas;Conjunto Arquitetônico e Paisagístico da Rua São Miguel: muros de pedra seca  escadas  passeios em lajes de pedra de minério;Rua São Miguel - Centro;CP;2008
Catas Altas;"Conjunto Arquitetônico e Paisagístico do Elevado de Pedras ""Bicame"" e seu entorno em Quebra Ossos";Povoado Morro d'Água Quente;CP;2001
Catas Altas;Capela do Senhor do Bonfim;Praça do Bonfim  s/nº- Povoado Morro d'Água Quente;BI;2010
Catas Altas;Imagem do Arcanjo Miguel;Igreja Matriz de Nossa Senhora da Conceição - Praça Monsenhor Mendes;BM;2010
Catas Altas;Chafariz da Praça da Matriz;Praça Monsenhor Mendes;BI;2003
Catas Altas;Capela de Santa Quitéria;Praça Santa Quitéria s/nº  - Centro;BI;2024
Catas Altas;Capela Sagrado Coração de Jesus;"RPPN  Santuário do Caraça - DATUM SIRGAS 2000, 23S, UTM n 7774055,644; E 660677,991";BI;2005
Catas Altas;Capela e Cemitério de Catas Altas;Rua Felício Alves da Silva s/nº- Bairro  Sol Nascente;BI;2010
Catas Altas;Gruta da Bocaina;"RPPN  Santuário do Caraça - DATUM SIRGAS 2000, 23S, UTM n 7774055,644; E 660677,991";CP;2008
Catas Altas;Ruínas de Moinhos e Caixas d'Água;Povoado Morro d'água Quente;BI;2003
Catas Altas;Conjunto da Praça Monsenhor Mendes;;CP;2000
Catas Altas;Sítio Arqueológico do Pico de Catas Altas - APPA Sul:  conjunto de abrigos de pedras , escavações e utensílios;;CP;2003
Catas Altas;Conjunto Arquitetônico e Paisagístico do Povoado do Morro d' Água Quente: 01 capela e 10 imóveis, muros e ruínas;"Capela Senhor do Bonfim, residências na Rua Direita nº: 224; 230; 312; 352; 463; 473; 568; residências na Rua Bonfim nº: 60 e 106; residência na Rua do Lago nº 94; muros n Rua Direita nº 41 e 49; muro na Rua Senhor do Bonfim nº 468; muro na Rua do Lago nº 10;  nº 13; nº45; 94 e 105; muro na Rua do Beco nº 11;  57 e 306 ; ruínas do moinho e caixas d'água";NH;2001
Catas Altas da noruega;Capela de Santo Antônio;Largo Santo Antônio s/nº;BI;2013
Catas Altas da noruega;Igreja Matriz de São Gonçalo do Amarante;Rua 29 de Julho s/nº;BI;2009
Catas Altas da noruega;Casa da Banda;Rua das Goiabeiras nº 102;BI;2013
Catas Altas da noruega;Capela do Senhor do Bonfim;Rua das Goiabeiras s/nº;BI;2013
Catas Altas da noruega;Museu e Arquivo Histórico  Memorial Padre Luiz Gonzaga Pinheiro;Rua Direita nº65;BI;2003
Catas Altas da noruega;Acervo de Bens Móveis;Museu e Arquivo Histórico  Memorial Padre Luiz Gonzaga Pinheiro  - Rua Direita nº65;BM;2003
Catas Altas da noruega;Conjunto Arquitetônico da Rua Lava-Pés;Rua Lava-Pés;CP;2012
Catas Altas da noruega;Capela Nossa Senhora do Livramento;Rua Nossa Senhora do Livramento s/nº;BI;2013
Catuti;Estação Ferroviária de Catuti;Praça Presidente Vargas s/nº;BI;
Catuti;Estação Ferroviária  e trilhos no entorno de 100m;Praça Presidente Vargas s/n°;BI;
