cidade;denominacao_do_bem_tombado;endereco;tipo;ano_de_tombamento
Itabirito;Igreja Matriz de Nossa Senhora da Boa Viagem;Praça Dom Silvério  s/n° - Bairro Boa Viagem;BI;2007
Itabirito;Conjunto da Área da Estação Ferroviária;Praça Doutor Guilherme - Centro;CP;2001/2007
Itabirito;Igreja Matriz de São Gonçalo do Amarante;Praça Padre Bernardo Firmino, s/n, Distrito de São Gonçalo do Bação;BI;2024
Itabirito;Imagem de Santo Antônio de Pádua;Praça São Sebastião  n° 143;BM;2007
Itabirito;Casarão Colonial - Casa de José Faria de Souza;Rua 7 de setembro  n° 76;BI;2002
Itabirito;Confederação Católica dos Trabalhadores de Itabirito;Rua Carlos Michel  n° 50/ 60 - Bairro  - Centro;BI;2002
Itabirito;Capela de Nossa Senhora do Rosário;Rua da Pimenta, s/nº -  Distrito de São Gonçalo do Bação;BI;2024
Itabirito;Casa de Isaltino Pereira Pedrosa;Rua do Rosário n° 13  - Bairro Boa Viagem;BI;2002
Itabirito;Residência da Senhora Maria Augusta Marques;Rua do Rosário n° 91 - Bairro Boa Viagem;BI;2002
Itabirito;Casa de Benjamim Francisco Passos;Rua do Rosário n° 104/ 96 - Bairro Boa Viagem;BI;2007
Itabirito;Casa de Amantino Basílio Pedrosa;Rua do Rosário  n° 13;BI;
Itabirito;Casa de Paulo Josafá;Rua do Rosário  n° 57/ 67 - Bairro Boa Viagem;BI;2001
Itabirito;Quartel da Polícia Militar;Rua Henrique Michel n° 203 - Bairro Boa Viagem;BI;2001
Itabirito;Capela do Senhor Bom Jesus do Matosinhos;Rua Matosinhos  s/n° - Bairro Matozinhos;BI;2007
Itabirito;Coral Canarinhos de Itabirito - Antigo Museu do Ferro;Rua Matozinhos n° 181 - Bairro Matozinhos;BI;2001
Itabirito;Núcleo Histórico do Distrito de Acuruí;;NH;2008
Itabirito;Capela de Gonçalo do Monte;Rua Principal s/nº -  Distrito de São Gonçalo do Monte;BI;2024
Itacambira;Clube Municipal Ildo Ferreira dos Santos;Avenida Deputado Frank Fort nº75;BI;2022
Itacambira;Missal Romano - Missale Romanum;Rua Grão Mogol nº 169;BM;2022
Itacambira;Conjunto Paisagístico da Serra Resplandecente;;CP;2007/2009
Itacarambi;Igreja Nossa Senhora da Imaculada Conceição;Praça da Igrejinha s/nº- Centro;BI;
Itaguara;Igreja Matriz Nossa Senhora das Dores;Praça Raimundo Morais Lara  s/n° - Centro;BI;2007
Itaguara;Imagem de Nossa Senhora das Dores;Igreja Matriz de Nossa Senhora das Dores - Praça Raimundo Morais Lara  s/n°;BM;2009
Itaguara;Escola Estadual Coronel Frazão;Rua Maria Felizarda nº 51  - Centro;BI;2023
Itaguara;Documentos Históricos de Itaguara - Documentos de Guimarães Rosa;Museu Sqagarana - Rua Mário Lima nº 100 - Centro;BM;
Itaguara;Capela Nossa Senhora da Conceição;Pará dos Vilelas;BI;2003
Itaguara;Conjunto Paisagístico do Engenho Velho;;CP;2011
Itajubá;Centro Saúde Almicar Pellon - Posto Puericultura;Avenida São Vicente de Paula  s/n°;BI;
Itajubá;Azulejaria da escadaria da Igreja Matriz Nossa Senhora Soledade – confeccionada pelo artista Luiz Teixeira;;BI;2007
Itajubá;Flauta do Maestro Francisco Nisticó;Acervo do Museu Wenceslau Braz - Praça Doutor José Braz;BM;2016
Itajubá;Antigo Palácio 26 de Fevereiro;Praça Adolpho Olinto  n° 67;BI;2013
Itajubá;Câmara e Prefeitura Municipal - Antigo Fórum;Praça Dona Amélia Braga n° 45;BI;2006
Itajubá;Escola Estadual Coronel Carneiro Júnior;Praça Getúlio Vargas  s/n°;BI;2013
Itajubá;Museu Wenceslau Braz - Antiga Estação Ferroviária e Depósito;Praça José Brás  s/n°;BI;2012
Itajubá;Igreja Matriz Nossa Senhora da Soledade;Praça Paulo Hartgers s/n°;BI;2000
Itajubá;Cinema Presidente;Praça Wenceslau Brás n° 59;BI;
Itajubá;Conjunto Paisagístico do Horto Florestal de Anhumas;Rua Brasópolis nº 02 - Bairro São Judas Tadeu;CP;2017
Itajubá;Escola Estadual Wenceslau Brás - Antigo Instituto Dom Bosco;Rua Olegário Maciel nº01;BI;2016
Itamarandiba;Fazenda Água Limpa;Distrito de Padre João Afonso;BI;
Itamarandiba;Igreja Nossa Senhora da Penha;Distrito de Penha de França;BI;2002
Itamarandiba;Edificação;Largo do Souza nº 31;BI;2002
Itamarandiba;Edificação;Largo do Souza nº57;BI;2002
Itamarandiba;Fazenda Santo Antônio;Ponte de Santana;BI;2002
Itamarandiba;Fazenda Boa Vista;Povoado de Santa Joana;BI;
Itamarandiba;Capela de Santa Luzia;Praça de Santa Luzia - Bairro São Geraldo;BI;2001
Itamarandiba;Capela de Nossa Senhora do Rosário dos Pretos;Praça Doutor Afonso Pavie;BI;2002
Itamarandiba;Edificação;Praça Getúlio Vargas nº 286;BI;2002
Itamarandiba;Edificação;Praça Getúlio Vargas nº 312;BI;2002
Itamarandiba;Edificação;Rua Aluísio Andrade Câmara nº116;BI;2002
Itamarandiba;Edificação;Rua Coronel Gentil Fernandes nº76 –  Centro;BI;2002
Itamarandiba;Edificação;Rua Diamantina nº 31 – Largo do Souza;BI;2002
Itamarandiba;Edificação;Rua Diamantina nº62;BI;2002
Itamarandiba;Edificação;Rua Dona Memeca nº37;BI;2002
Itamarandiba;Edificação;Rua Largo de Souza nº87;BI;2002
Itamarandiba;Edificação;Rua Largo do Souza nº59;BI;
Itamarandiba;Edificação;Rua Padre Afonso nº8;BI;
Itamarandiba;Edificação;Rua Padre Afonso nº8A;BI;
Itamarandiba;Edificação;Rua Padre João Afonso nº02 –  Centro;BI;
Itamarandiba;Edificação;Rua Padre João Afonso nº08;BI;2002
Itamarandiba;Edificação;Rua Padre João Afonso nº110;BI;
Itamarandiba;Edificação;Rua Padre João Afonso nº112;BI;2001
Itamarandiba;Edificação;Rua Padre João Afonso nº117 – Centro;BI;
Itamarandiba;Edificação;Rua Padre João Afonso nº17– Centro;BI;
Itamarandiba;Edificação: Fachadas lateral esquerda e direita, área frontal;Rua Padre João Afonso nº20;BI;2002
Itamarandiba;Edificação;Rua Padre João Afonso nº22 – Centro;BI;
Itamarandiba;Edificação;Rua Padre João Afonso nº38/ 42;BI;2002
Itamarandiba;Edificação;Rua Padre João Afonso nº46;BI;
Itamarandiba;Edificação;Rua Padre João Afonso nº60 –  Centro;BI;
Itamarandiba;Edificação;Rua Padre João Afonso nº72;BI;
Itamarandiba;Edificação;Rua Sinhá Bié nº 34 - Bairro  Fazendinha;BI;2002
Itamarandiba;Prefeitura Municipal – ex- Acesita;Rua Tabelião Andrade  nº 177;BI;2002
Itamarandiba;Edificação;Rua Aluísio Andrade Câmara nº 22;BI;2002
Itamarandiba;Edificação;Rua Tiradentes nº 110;BI;2002
Itamarandiba;Edificação;Rua Tiradentes nº 111;BI;2002
Itamarandiba;Edificação;Rua Tiradentes nº 130;BI;2002
Itamarandiba;Edificação;Rua Tiradentes nº 138;BI;2002
Itamarandiba;Edificação;Rua Tiradentes nº 169;BI;2002
Itamarandiba;Edificação;Rua Tiradentes nº 193;BI;2002
Itamarandiba;Edificação;Rua Tiradentes nº 31;BI;2002
Itamarandiba;Edificação;Rua Tiradentes nº 34;BI;2002
Itamarandiba;Edificação;Rua Tiradentes s/nº;BI;2001
Itamarandiba;Igreja Matriz de São João Batista;;BI;2001
Itamarandiba;Imagem de Nossa Senhora Sant'Ana;Rua Largo de Souza nº 87;BM;2002
Itamarandiba;Gruta da Lapa Santa;;CP;
Itamarandiba;Capela Bom Jesus da Lapa;Largo de Bom Jesus da Lapa;BI;2002
Itamarati de Minas;Sítio Natural do Morro da Laje;Margem direita da Estrada de Itamarati de Minas/Descoberto, Km 01 - Zona Rural, E: 725.215,029 – n: 7.629.465,060;CP;
Itamarati de Minas;Sítio Natural Pedra Branca;Latitude: 21° 24’ 19.52” S Longitude: 42° 50’ 50.36” O;CP;2013
Itambacuri;Santuário Nossa Senhora dos Anjos;Praça São Francisco de Assis, s/nº - Centro;BI;2026
Itambacuri;Museu de Artes - Antigo Fórum;Rua Romeu Lage nº 1281 - Centro;BI;2004
Itambé do Mato Dentro;Conjunto Arqueológico e Paisagístico da Serra dos Milagres;Estrada de Itambé do Mato Dentro, sentido Senhora do Carmo;CP;2003
Itambé do Mato Dentro;Conjunto de Retábulos da Capela-Mor da Igreja Matriz de Nossa Senhora das Oliveiras;Igreja Matriz de Nossa Senhora das Oliveiras - Praça 1º de Março nº 50;BM;2006
Itambé do Mato Dentro;Sítio Natural Paisagístico e Arqueológico da Serra dos Veados;Povoado de Santana do Rio Preto - Cabeça de Boi;CP;2020
Itambé do Mato Dentro;Fazenda Mumbuca;;BI;2011
Itamogi;Pontilhão Ferroviário;Bairro  Tapir;BI;2013
Itamogi;Conjunto Ferroviário;Rua Waldorimo Magalhães nº 666 - Estação;CP;2013
Itamogi;Prefeitura Municipal – Atual Biblioteca Municipal;Rua Wenceslau Braz  nº 516 - Centro;BI;2008
Itamonte;Capela de São Francisco de Assis: Fachada;Rua Presidente Vargas nº 308 - Centro;BI;
Itamonte;Casarão da Fazenda Engenho de Serra;Rodovia 354 - Bairro Engenho da Serra;BI;2026
Itamonte;Conjunto Paisagistico Usina dos Braga;Estrada do Morro Grande Km 7;CP;2026
Itamonte;Antiga Fazenda Bananal: Sede;;BI;2019
Itamonte;Igreja de Nossa Senhora da Conceição;;BI;
Itamonte;Igreja Nossa Senhora da Conceição;;BI;2024
Itamonte;Imagem de Nossa Senhora da Conceição;Casa Paroquial - Igreja Matriz de São José;BM;2008
Itanhandu;Edificação;Praça Wenceslau Braz nº 45;BI;
Itanhandu;Casa da Família Sampaio - Solar Maria Luiza;Rua Engenheiro Paulo Franco da Rosa nº 53 - Centro;BI;2025
Itanhandu;Hotel Casarão;Avenida Fernando Costa nº 205 - Centro;BI;2016
Itanhandu;Casa do Professor Brito;Avenida Fernando Costa nº 657 - Centro;BI;
Itanhandu;Escola Municipal Felipe dos Santos;Avenida Professor Brito nº 206 - Centro;BI;2013
Itanhandu;Conjunto Paisagístico da Cachoeira do Vô Delfim;WGS 84 - Coordenadas: 22° 21'14,5'' S e 44° 54'29,62'';CP;2024
Itanhandu;Praça Joaquim Figueiredo - Praça da Magnólia;;CP;
Itanhandu;Igreja Matriz Nossa Senhora da Conceição;Praça Amador Guedes  s/nº;BI;2015
Itanhandu;Imagem de Nossa Senhora da Conceição;Igreja Nossa Senhora da Conceição - Praça Amador Guedes  s/nº;BM;2008
Itanhandu;Casa do Senhor Walter Perrone Scarpa;Rua nicolau Scarpa nº 251;BI;2016
Itanhandu;Conjunto Ferroviário Urbano de Itanhandu;Rua João Batista Scarpa - Avenida Fernando Costa;CP;2009
Itanhomi;Edificação;Avenida Juscelino Kubitscheck nº 268 - Centro;BI;2025
Itanhomi;Conjunto Paisagistico da Praça da Matriz do Sagrado Coração de Jesus;Ruas José Florêncio da Costa, Francisco Abreu Mafra e pela Avenida Juscelino Kubistchek;CP;2012
Itanhomi;Arquivo Fotográfico: 83 fotos em molduras individuais e painéis coletivos;Casarão da Secretaria de Educação e Cultura - Avenida JK nº 268 - Centro;BM;2013
Itanhomi;Busto do Capitão Andrade;Praça da Matriz - Centro;BI;2009
Itaobim;Igreja de São Roque;Bairro  Comércio Velho;BI;2013
Itaobim;Imagem de São João;Rua Principal - Comunidade de São João Grande;BM;2013
Itapagipe;Capela do Senhor Bom  Jesus da Lapa;Avenida 23,  entre as Ruas Doze e Quatorze;BI;2009
Itapagipe;Conjunto Paisagístico Córrego Lageado;Entre a rodovia MG 255 e a Avenida do Contorno;CP;2013
Itapagipe;Coletânea de fotos arquivadas na Prefeitura;Rua Dez  nº 543;BM;2008
Itapecerica;Ermida de Nossa Senhora das Dores;Distrito de Sucupira;BI;2009
Itapecerica;Núcleo Histórico Itapecerica;;NH;2008
Itapecerica;Imagem de Santa Rita;Paço de Santa Rita - Rua Necésio Tavares, esquina com Rua Cônego Domiciano  s/nº;BM;2004
Itapecerica;Igreja Nossa Senhora do Rosário;Praça do Rosário  s/nº- Centro;BI;2007
Itapecerica;Igreja de Nossa Senhora do Desterro;Praça Manoel Carvalho da Silva  s/nº - Distrito de Marilandia;BI;2001/2007
Itapecerica;Igreja Matriz de São Bento;Praça São Bento  s/nº - Centro;BI;2007
Itapecerica;Igreja de São Francisco;Praça São Francisco  s/nº;BI;2007
Itapecerica;Sítio Natural - Capoeira do Padre Herculano Paz;;CP;2010
Itapecerica;Igreja Nossa Senhora das Mercês;Rua Coronel Leopoldo s/nº esquina com Rua Rodrigues Pereira - Centro;BI;2004
Itapecerica;Museu Bento Ernesto Júnior - Antiga casa do Capitão-Mor;Rua Hermano Ferreira de Carvalho nº 153;BI;
Itapeva;Imagem de Nosso Senhor Morto;Igreja Maatriz de São Sebastião - Praça de São Sebastião s/nº;BM;2006
Itapeva;Igreja Matriz de São Sebastião;Praça São Sebastião  s/nº;BI;2007
Itatiaiuçu;Monumento Cristo Redentor;Alto do Bairro  Pio XII;BI;
Itatiaiuçu;Centro Recreativo Desportivo e Comunitário de Itatiaiuçu Antônio Penido Guimarães;Avenida Gerônimo Pedroso nº 563 - Bairro  Pio XII;BI;
Itatiaiuçu;Pico da Serra Grande - Pico do Itatiaiuçu;Bairro  Vieiras - BR 381;CP;2001
Itatiaiuçu;Cachoeira de São José - Cachoeira dos Chaves;Córrego Retiro dos Pintos;CP;2001
Itatiaiuçu;Igreja Matriz de São Sebastião;Praça Antônio Quirino da Silva;BI;2001
Itatiaiuçu;Escola Municipal João Marques Machado;Rua Santa Luzia  nº 270 - Bairro  Robert Kennedy;BI;2003
Itatiaiuçu;Imagem Cristo Redentor;;BM;
Itaú de Minas;Estação Ferroviária;;BI;
Itaú de Minas;Antigos Vagões da Companhia Mogiana;Linha férrea próxima à antiga Estação Ferroviária;BM;2005
Itaú de Minas;Conjunto Arquitetônico do CECOI - Companhia Cimento Portland Itaú;Rua Doutor José Balbino;CP;
Itaú de Minas;Capela de Nossa Senhora da Penha;Rua Massaud Mattar com Praça Dionísio Pereira da Fonseca  s/nº;BI;2006
Itaú de Minas;Fazenda Córrego do Ferro;;CP;
Itaúna;Escola Municipal Doutor Augusto Gonçalves : Fachadas;Rua João de Cerqueira Lima nº 82 - Centro;BI;
Itaúna;Residência Rodrigues Prado:  3 Fachadas;Rua Professor Francisco Santiago nº15;BI;
Itaúna;Clínica de Olhos Doutor Argos Penido: Fachadas;Rua Silva Jardim nº 211;BI;
Itaúna;Residência Coronel João de Cerqueira Lima;Rua Silva Jardim nº 212;BI;2025
Itaúna;Igreja Matriz de Sant’Ana;Praça Doutor Augusto Gonçalves s/nº;BI;2025
Itaúna;Antiga Casa de Caridade Manoel Gonçalves de Souza Moreira: Fachadas e ruínas;Avenida Miguel Augusto Gonçalves nº1902 - Bairro São Judas Tadeu;BI;2024
Itaúna;Antiga Estação Ferroviária;Bairro Santanense;BI;2024
Itaúna;Imagem de Nossa Senhora de Sant'Ana / Sant'Ana Mestra;Matriz de Sant'Ana - Praça Augusto Gonçalves  s/nº - Centro;BM;2018
Itaúna;Monumento Doutor Augusto Gonçalves;Praça Doutor Augusto Gonçalves - Centro;BM;2024
Itaúna;Locomotiva Maria Fumaça;Praça João Pessoa -  Praça da Estação s/nº - Centro;BM;2024
Itaúna;Conjunto Urbano e Arquitetônico do Morro do Rosário;;CP;2003
Itaúna;Casa do Engenheiro da RFFSA;Praça Waldir de Ávila  s/nº;BI;2002
Itaúna;Museu Municipal Francisco Manoel Franco;Rua Antônio Corradi  s/nº;BI;2011
Itaúna;Casarão do Doutor  Augusto Gonçalves de Souza Moreira;Rua João de Cerqueira Lima nº123;BI;2003
Itaúna;Escola Municipal Doutor Augusto Gonçalves: Fachada;Rua João de Cerqueira Lima nº 82  - Centro;BI;
Itaúna;Escola Normal de Itaúna;Rua Professor Francisco Santiago nº 275 - Centro;BI;2024
Itaúna;Gruta Nossa Senhora de Itaúna;Rua Sesóstes Milagre  s/nº - Bairro  de Lourdes;CP;2007
Itaúna;Imagem de Nossa Senhora de Itaúna;Gruta de Nossa Senhora de Itaúna - Rua Sesóstes Milagre  s/nº  - Bairro  de Lourdes;BM;2006
Itaúna;Biblioteca Pública Municipal Engenheiro Osmário Soares Nogueira;Rua Zezé Lima nº 176 - Centro;BI;2024
Itaúna;Monumento aos Fundadores da Companhia Industrial Itaunense;Rua Zezé Lima - esquina com Rua Coronel João de Cerqueira Lima s/n° - Centro;BM;2024
Itaúna;"Capela do Morro de Nosso Senhor do Bonfim; Igreja do Bonfim";Morro do Bonfim;BI;
Itaúna;Capela São Vicente de Paulo;Avenida Getúlio Vargas nº 384 - Centro;BI;
Itaúna;Residência Saldanha: Fachada e varanda;Rua Silva Jardim nº152 - Centro;BI;2025
Itaverava;Imagem de São Sebastião;Capela de São Sebastião - Distrito de Monsenhor Izidro;BM;2016
Itaverava;Moinho da Cachoeira da Água Limpa;Fazenda da Cachoeirinha, s/nº- Zona Rural;BI;2015
Itaverava;Conjunto Paisagístico da Praça São Sebastião;Praça de São Sebastião - Distrito de Monsenhor Izidro;CP;2020
Itaverava;Núcleo Histórico Urbano de Itaverava;Praça Monsenhor Isidro, Rua Antônio Roberto, Rua Barão de Coromandel, Praça Cônego Acrísio de Assis Reis, Rua Pinto Paraíso e Rua Sebastião Leão;NH;2018
Itaverava;Capela de São Sebastião;Rua São Sebastião  s/nº;BI;
Itinga;Sobrado do Colégio;Travessa do Colégio s/nº- Centro;BI;
Itinga;Casarão Soares Teixeira;Avenida Professora Maria Antônia Gonçalves Reis nº 171;BI;2023
Itinga;Usina Hidrelétrica Prefeito José Gusmão;Comunidade Água Fria Fabrica;BI;2023
Itinga;Imagem de São Vicente de Paulo;Igreja Matriz de Santo Antônio - Praça Hemiliano Gusmão;BM;2011
Itinga;Mercado Municipal;Praça Precillo Gusmão nº 36 - Centro;BI;2023
Itueta;Igreja Matriz de São João Batista;Rua São João Batista nº330;BI;2024
Itueta;Imagem do Senhor Morto;Igreja Matriz de São João Batista - Rua São João Batista nº 330;BM;2024
Ituiutaba;Serra do Corpo Seco;Morro de São Vicente;CP;
Ituiutaba;Panelas indígenas;Casa da Cultura - Avenida 3 nº240;BM;2005
Ituiutaba;Casa da Cultura Altair Alves Ferreira;Avenida 3 nº 240;BI;2005
Ituiutaba;Praça Cônego Ângelo;Avenida 9 com Ruas Vinte e Vinte e Dois - Centro;CP;2000/2007
Ituiutaba;Ponte sobre o Rio Tijuco - Ponte Raul Soares;;BI;2000
Ituiutaba;Selaria do Capitão;Rua 16  nº824;BI;
Ituiutaba;Prensa Tipográfica móvel da Gráfica Cultural Jaci de Almeida: Prensa tipográfica e bens integrados;Fundação Cultural de Ituiutaba - Rua Vinte e Quatro nº 1342 - Centro;BM;2019
Ituiutaba;Teatro Oduvaldo Viana Filho;Rua 24 nº 154;BI;2007
Ituiutaba;Escola João Pinheiro;;BI;
Ituiutaba;Parque do Goiabal - Parque Municipal Doutor Petrônio Rodrigues Chaves;Zona: 22K E 663.380,00  N 7.897.724,00;CP;
Ituiutaba;Usina da Empresa Força e Luz Ituiutabana - Usina do Salto de Moraes;;BI;
Itumirim;Imagem Nossa Senhora Rosário;Capela do Rosário - Distrito de Rosário;BM;2010
Itumirim;Igreja Nossa Senhora Rosário;;BI;
Itumirim;Praça Chicre Zákhia;Praça Chicre Záchkia;CP;
Itumirim;Passinho da Paixão;Praça Chicre Záchkia s/nº;BI;2007
Itumirim;Casa Paroquial;Praça Chicre Zákhia s/nº;BI;
Itumirim;Igreja Matriz de São José;Praça Chicre Zákhia  s/nº;BI;2007
Itumirim;Estação Ferroviária de Itumirim;Praça da Bandeira  s/nº;BI;2003
Itumirim;Capela Nosso Senhor dos Passos;Praça dos Passos nº 39;BI;2007
Itumirim;Fórum Municipal Sebastião José da Costa;Praça dos Três Poderes nº 143;BI;
Itumirim;Prefeitura Municipal;Praça dos Três Poderes  s/nº;BI;
Itumirim;Capela Nossa Senhora Aparecida;Praça Nossa Senhora Aparecida  s/nº;BI;2007
Itumirim;Escola Municipal Castro Alves;Rua São José nº 138;BI;2007
Iturama;Primeira Escola Pública - Casa da Memória;Rua São Paulo nº352  esquina Avenida Rio Grande;BI;2011
Iturama;Casa de Saúde e Maternidade Santa Rosa;Rua São Paulo nº 630;BI;2014
Itutinga;Praça Santo Antônio de Pádua;Entre a continuação da Rua Presidente Tancredo de Almeida neves, Rua Lavras, Rua Santo Antônio e Rua Antenor Augusto;CP;
Jaboticatubas;Imagem de Santa Efigênia;Igreja Nossa Senhora do Rosário - Praça Coronel Francisco Alves dos Santos, s/n,  - Centro;BM;2025
Jaboticatubas;Imagem de Nossa Senhora das Dores;Avenida Benedito Valadares nº 456 - Centro;BM;
Jaboticatubas;Imagem de Nosso Senhor dos Passos;Avenida Benedito Valadares nº 456 - Centro;BM;
Jaboticatubas;Imagem do Senhor Morto;Avenida Benedito Valadares nº 456 - Centro;BM;
Jaboticatubas;Imagem de São Benedito;Igreja Nossa Senhora do Rosário - Praça Coronel Francisco Alves dos Santos s/nº  - Centro;BM;2025
Jaboticatubas;Imagem de São José de Botas;Acervo da Igreja Nossa Senhora do Rosário - Praça do Rosário  s/nº;BM;2007
Jaboticatubas;Fazenda das Minhocas e Engenhos;;BI;
Jaboticatubas;Igreja Nossa Senhora do Rosário;Praça Coronel Francisco Alves s/nº - Centro;BI;2001
Jaboticatubas;Imagem de Nossa Senhora do Rosário;Praça Coronel Francisco Alves s/nº - Centro;BM;2021
Jaboticatubas;Castanheiras da Praça Padre Messias;Na frente da Igreja Matriz, na Avenida Benedito Valadares, englobando a área da Igreja Matriz, chegando na Rua Padre Pedro Passos, seguindo uma linha reta imaginária até a rua a Rua Teófilo Augusto, seguindo esta última até o encontro com a Rua Santa Luzia e fechando o limite no encontro da Rua Santa Luzia com a Avenida Benedito Valadares, em frente à Igreja Matriz;CP;2001
Jaboticatubas;Conjunto Arquitetônico e Paisagístico da Igreja Nossa Senhora  da Conceição e Praça das Castanheiras;Conjunto Arquitetônico e Paisagístico da Igreja de Nossa Senhora da Conceição e Praça das Castanheiras compreende a area: tomando como início, em frente à Igreja Matriz, na Avenida Benedito Valadares, englobando a área da Igreja Matriz, tendo como limite o Beco da Matriz, chegando à Rua Padre Pedro Passos, indo em direção ao encontro da Rua Santo Antônio com a Rua Teófilo Augusto, seguindo esta última até o encontro com a Rua Santa Luzia e fechando o limite no encontro da Rua Santa Luzia com a Avenida Benedito Valadares, em frente à Igreja Matriz;CP;2007
Jaboticatubas;Parque Nacional Serra do Cipó;Rodovia MG - 10  próximo ao KM 94;CP;2001
Jaboticatubas;Conjunto Arquitetura da Fazenda do Cipó: Fazenda, Senzala e Capela;"A área de entorno do bem tombado compreende a área a partir do Rio Cipó, na Fazenda do Cipó, percorrendo os limites de propriedades, curso d’água e vias públicas seguintes: Rio Cipó até o limite da propriedade dos herdeiros de João nogueira Duarte, seguindo limite dessa propriedade com a Fazenda do Campinho até sua confluência com a via de acesso à Fazenda do Cipó; via de acesso à Fazenda do Cipó, em toda sua extensão, atingindo o Rio Cipó.";CP;2001
Jaboticatubas;Áreas de Proteção dos Mananciais;;CP;
Jaboticatubas;Áreas do Entorno do Parque Nacional da Serra do Cipó - APA Morro da Pedreira;Municípios de Santana do Riacho, Conceição do Mato Dentro, Itambé do Mato Dentro, Morro do Pilar, Jaboticatubas, ItabiraTaquaraçu de Minas e Nova União;CP;
Jaceaba;Estação Ferroviária Engenheiro Caetano Lopes;Chegada a Caetanos Lopes a partir de Jaceaba, próximo ao leito da extinta Rede Ferroviária Federal - Centro;BI;
Jacuí;Fazenda Cabral: Sede;Localização: S200º59'477'' - W46º45' - Cabral;BI;2006
Jacuí;Fazenda São José: Sede;Estrada de Jacuí a Bom Jesus da Penha, Km 01- Zona Suburbana de Jacuí;BI;2006
Jacuí;Casa da Cultura e Cadeia;Praça Presidente Vargas nº74;BI;2005
Jacuí;Arquivo Miscelânea Executivo Municipal  de 1883 a 1979;Arquivo Municipal - Praça Presidente Vargas nº 45;BM;2007
Jacuí;Residência Senhora Esmeralda Alcântara Assad;Praça Presidente Vargas nº 71;BI;2005
Jacuí;Paço Municipal;Praça Presidente Vargas nº 72;BI;2007
Jacuí;Escadaria de acesso à Antiga Usina Hidrelétrica;Prolongamento da Rua Duque de Caxias  s/nº;BI;2004
Jacuí;Antiga Usina Hidrelétrica;Rua Antônio Marcondes nº 184;BI;2004
Jacuí;Residência Espólio Arthur Freire;Rua Coronel Antônio Cândido nº 32;BI;2005
Jacuí;Residência Espólio Carlos Uiras;Rua Barão do Rio Branco nº 84 - Centro;BI;2005
Jacuí;Residência da SenhoraTita Deud;Rua Governador Valadares nº 114;BI;2007
Jacuí;Antigo Cine Clube de Jacuí;Rua João Pessoa nº 41;BI;2007
Jacutinga;Estação Ferroviária;Praça Delfim Moreira  s/nº;BI;2007
Jacutinga;Painel de Azulejos - Poverelo São Francisco de Assis;Rua dos Expedicionários  s/nº;BM;2008
Jaguaraçu;Imagem de São José;Igreja de São José- Rua do Rosário;BM;2018
Janaúba;Bilioteca Pública Municipal Lilia Gonzaga Cavalcanti;Avenida Brasil nº 660 –  Centro;BI;2021
Janaúba;Conjunto Paisagístico e Arquitetônico da Praça Doutor Roberto e Capela do Senhor Bom Jesus;Praça Doutor Rocket: Ruas Antunino Antunes - Marcolino Evangelista Barbosa - Rua Francisco Sá e a paralela localizada na porção posterior da Capela do Senhor Bom Jesus;CP;2021
Januária;Casa da Memória do Vale do São Francisco;Praça Artur Bernardes  nº 22;BI;2001
Januária;Calçamento da Rua Cônego Marinho;;CP;2001
Januária;Calçamento da Rua Visconde de Ouro Preto;;CP;2001
Japaraíba;Cruzeiro da Antiga Igreja Nossa Senhora do Rosário;Avenida Olegário Bernardes Amorim – Praça do Cemitério;BM;2022
Japaraíba;Estação Carlos Bernardes;Povoado Carlos Bernardes;BI;
Japaraíba;Imagem de Nossa Senhora do Rosário;A cervo particular da Família Fernandes - Rua José Felipe Melo nº26;BM;2011
Jeceaba;Estação Ferroviária de Jeceaba;Praça Sebastião Augusto Dias s/nº;BI;2020
Jeceaba;Imagem do Senhor Morto de Bituri;Capela de Nossa Senhora das Dores;BM;2023
Jenipapo de Minas;Capela da Fazenda do Riacho;Comunidade rural do Riacho;BI;2013
Jenipapo de Minas;Fazenda do Riacho;Comunidade rural do Riacho;BI;2013
Jenipapo de Minas;Oratório das Irmãs Mendonça;Fazenda Setubal/ Funil;BM;2011
Jenipapo de Minas;Capela de São Sebastião;Praça Bom Pai  s/nº;BI;2013
Jequeri;Mirante Cerca-lá;;CP;2007
Jequeri;Coreto da Praça Tenente Mol;Praça Tenente Mol  em frente à Igreja Matriz;BI;2004
Jequeri;Livro Como Surgiu a Nossa Comunidade - fotos;Escola Estadual Tenente Mol - Rua Padre Benevenuto nº 07;BM;2005
Jequitaí;Casa Cônego Clemente Laurens;Rua Diamantina nº308;BI;
Jequitibá;Ruínas do Cemitério Velho de Jequitibá;Rua José Ferreira da Silva s/nº - Bairro Coronel Caetano Mascarenhas;BI;
Jequitibá;Cemitério Velho - Ruínas do Cemitério Velho;Rua José Ferreira da Silva s/nº- Bairro Coronel Caetano Mascarenhas;BI;
Jequitinhonha;Cruzeiro dos Martírios;Adro da Igreja Santo Antônio;BI;
Jequitinhonha;Tamarineiro;às margens do Rio Jequitinhonha;BI;
Jequitinhonha;Conjunto Urbanístico da Avenida Pedro Ferreira e Praça Coronel Franco;Avenida Pedro Ferreira, Praça Coronel Franco, Praça Virgem da Lapa, Rua Benedito Valadares, Travessa São Miguel, Rua Isidoro Murta, Rua Inácio Murta, Beco Helio Campolina e Travessa Arnaldo do Povo.;CP;1998
Jequitinhonha;Cruz de Metal e Alfaias;Igreja São Miguel e Almas - Praça Virgem da Lapa  s/nº;BM;
Jequitinhonha;Igreja de Nossa Senhora da Ajuda;Praça Nossa Senhora d'Ajuda  s/nº - Povoado de Estiva;BI;2000
Jequitinhonha;Igreja de Nossa Senhora da Boa Viagem;Praça Tancredo Neves nº88 - Distrito de Guaranilândia;BI;2000
Jequitinhonha;Igreja Matriz de São Miguel e Almas;Praça Virgem da Lapa s/nº;BI;2001
Jequitinhonha;Igreja de Nossa Senhora das Graças;Rua Belo Horizonte  s/nº  esquina com Avenida Brasil;BI;2000
Jequitinhonha;Casa do Senhor Minervino;Rua Benedito Valadares nº 84;BI;2001
Jequitinhonha;Escola Estadual nuno Melo;Rua Coronel Ramiro Pereira  nº 228;BI;2001
