cidade;denominacao_do_bem_tombado;endereco;tipo;ano_de_tombamento
Itanhandu;Conjunto Paisagístico da Cachoeira do Vô Delfim - 3,35 ha;WGS 84 - Coordenadas: 22° 21'14,5'' S e 44° 54'29,62'';CP;2024
Itanhandu;Igreja Matriz Nossa Senhora da Conceição;Praça Amador Guedes s/nº;BI;2015
Itanhandu;Imagem de Nossa Senhora da Conceição;Igreja de Nossa Senhora da Conceição - Praça Amador Guedes s/nº;BM;2008
Itanhandu;Casa do Senhor Walter Perrone Scarpa;Rua nicolau Scarpa nº 251;BI;2016
Itanhandu;Conjunto Ferroviário Urbano de Itanhandu - 0,54 ha;Rua João Batista Scarpa, Avenida Fernando Costa;CP;2009
Itanhomi;Casarão;Avenida Juscelino Kubitscheck, nº 268 - Centro;BI;2025
Itanhomi;Conjunto Paisagistico da Praça da Matriz do Sagrado Coração de Jesus - 0,26 ha;Conjunto paisagístico contornado pelas ruas José Florêncio da Costa, Francisco Abreu Mafra e pela avenida Juscelino Kubistchek;CP;2012
Itanhomi;Arquivo Fotográfico com 83 fotos  sendo algumas em molduras individuais  outras em painéis coletivos;Casarão da Secretaria de Educação e Cultura - Avenida JK,  nº 268 - Centro;BM;2013
Itanhomi;Busto do Capitão Andrade;Praça da Matriz - Centro;BI;2009
Itaobim;Igreja de São Roque;Bairro  Comércio Velho;BI;2013
Itaobim;Imagem de São João;Rua Principal - Comunidade de São João Grande;BM;2013
Itapagipe;Capela do Senhor Bom  Jesus da Lapa;Avenida 23,  entre as Ruas Doze e Quatorze;BI;2009
Itapagipe;Conjunto Paisagístico Córrego Lageado - 10,76 ha;Entre a Rodovia MG 255 e a Avenida do Contorno;CP;2013
Itapagipe;Coletânea de fotos arquivadas na prefeitura;Rua Dez  nº 543;BM;2008
Itapecerica;Ermida de Nossa Senhora das Dores;Distrito de Sucupira;BI;2009
Itapecerica;Núcleo Histórico Itapecerica - 2000 unidades - 63,50 ha;Distrito sede Itapecirica;NH;2008
Itapecerica;Imagem de Santa Rita;Paço de Santa Rita - Rua Necésio Tavares, esquina com Rua Cônego Domiciano  s/ nº;BM;2004
Itapecerica;Igreja Nossa Senhora do Rosário;Praça do Rosário s/nº - Centro;BI;2007
Itapecerica;Igreja de Nossa Senhora do Desterro;Praça Manoel Carvalho da Silva s/nº - Distrito de Marilandia;BI;2007
Itapecerica;Igreja Matriz de São Bento;Praça São Bento s/nº - Centro;BI;2007
Itapecerica;Igreja de São Francisco;Praça São Francisco  s/ nº;BI;2007
Itapecerica;Capoeira do Padre Herculano Paz - Sítio Natural Padre Herculano Paz -  3,8125 ha;A Capoeira Padre Herculano Paz encontra-se inserida na sede urbana do município de Itapecerica, não possuindo vias dentro do seu perímetro de tombamento.;CP;2010
Itapecerica;Igreja Nossa Senhora das Mercês;Rua Coronel Leopoldo  s /nº esquina com Rua Rodrigues Pereira - Centro;BI;2004
Itapeva;Imagem de Nosso Senhor Morto;Igreja Matriz de São Sebastião -Praça de São Sebastião s/nº;BM;2006
Itapeva;Igreja Matriz de São Sebastião;Praça São Sebastião  s/ nº;BI;2007
Itatiaiuçu;Pico da Serra Grande - Pico do Itatiaiuçu - 62,500 ha;Bairro  Vieiras - BR 381;CP;2001
Itatiaiuçu;Cachoeira de São José ou dos Chaves - 16 ha;Córrego Retiro dos Pintos;CP;2001
Itatiaiuçu;Igreja Matriz de São Sebastião;Praça Antônio Quirino da Silva;BI;2001
Itatiaiuçu;Escola Municipal João Marques Machado;Rua Santa Luzia  nº 270 - Bairro  Robert Kennedy;BI;2003
Itaú de Minas;Antigos Vagões da Companhia Mogiana;Linha férrea próxima à antiga Estação Ferroviária;BM;2005
Itaú de Minas;Capela de Nossa Senhora da Penha;Rua Massaud Mattar com Praça Dionísio Pereira da Fonseca s/nº;BI;2006
Itaúna;Residência Coronel João de Cerqueira Lima;Rua Silva Jardim nº212;BI;2025
Itaúna;Igreja Matriz de Sant’Ana;Praça Doutor Augusto Gonçalves s/nº;BI;2025
Itaúna;Fachada e das ruínas da antiga casa de Caridade Manoel Gonçalves de Souza Moreira;Avenida Miguel Augusto Gonçalves, nº1902 Bairro São Judas Tadeu;BI;2024
Itaúna;Antiga Estação Ferroviária do Bairro Santanense;Bairro Santanense;BI;2024
Itaúna;Imagem de Nossa Senhora de Sant'Ana / Sant'Ana Mestra;Matriz de Sant'Ana - Praça Augusto Gonçalves s/nº - Centro;BM;2018
Itaúna;Monumento Doutor Augusto Gonçalves;Praça Doutor Augusto Gonçalves, Bairro Centro;BM;2024
Itaúna;Locomotiva Maria Fumaça;Praça João Pessoa, Praça da Estação, s/nº, Centro;BM;2024
Itaúna;Conjunto Urbano e Arquitetônico do Morro do Rosário - 2,6 ha;Praça Manoel Pinto Moreira  s/ nº;CP;2003
Itaúna;Casa do Engenheiro da RFFSA;Praça Waldir de Ávila s/nº;BI;2002
Itaúna;Museu Municipal Francisco Manoel Franco;Rua Antônio Corradi s/nº;BI;2011
Itaúna;Casarão do Doutor Augusto Gonçalves de Souza Moreira - Descaracterizado Exerc. 2016;Rua João de Cerqueira Lima  nº123;BI;2003
Itaúna;Escola normal de Itaúna;Rua Professor Francisco Santiago, nº275, Bairro Centro;BI;2024
Itaúna;Gruta Nossa Senhora de Itaúna - 1,5 ha;Rua Sesóstes Milagre s/nº  - Bairro  de Lourdes;CP;2007
Itaúna;Imagem de Nossa Senhora de Itaúna;Gruta Nossa Senhora de Itaúna - Rua Sesóstes Milagre s/nº  - Bairro  de Lourdes;BM;2006
Itaúna;Biblioteca Pública Municipal Engenheiro Osmário Soares Nogueira - Casa do Padre José Ferreira Netto;Rua Zezé Lima, nº176, Centro;BI;2024
Itaúna;Monumento aos fundadores da Companhia Industrial Itaunense;Rua Zezé Lima, esquina com Rua Coronel João de Cerqueira Lima, s/nº - Centro;BM;2024
Itaúna;Fachada e varanda da Residência Saldanha;Rua Silva Jardim, nº152, Bairro Centro;BI;2025
Itaverava;Imagem de São Sebastião;Capela de São Sebastião - Distrito de Monsenhor Izidro;BM;2016
Itaverava;Moinho da Cachoeira da Água Limpa;Fazenda da Cachoeirinha,s/nº - Zona Rural;BI;2015
Itaverava;Conjunto Paisagístico da Praça São Sebastião - 0,441 ha;Praça de São Sebastião, Distrito de Monsenhor Izidro;CP;2020
Itaverava;Núcleo Histórico Urbano de Itaverava - 20 unidades;Praça MonsenhorIsidro, Rua Antônio Roberto, Rua Barão de Coromandel, Praça Cônego Acrísio de Assis Reis, Rua Pinto Paraíso e Rua Sebastião Leão - Sede;NH;2018
Itinga;Casarão Soares Teixeira;Avenida Professora Maria Antônia Gonçalves Reis  nº 171;BI;2023
Itinga;Usina Hidrelétrica Prefeito José Gusmão;Comunidade Água Fria Fabrica;BI;2023
Itinga;Imagem de São Vicente de Paulo;Matriz de Santo Antônio -Praça Hemiliano Gusmão;BM;2011
Itinga;Mercado Municipal;Praça Precillo Gusmão nº 36 - Centro;BI;2023
Itueta;Igreja Matriz de São João Batista;Rua São João Batista,nº 330;BI;2024
Itueta;Imagem do Senhor Morto;Rua São João Batista, nº330;BM;2024
Ituiutaba;Panelas indígenas;"Casa da Cultura ""Altair Alves Ferreira"" - Avenida Três  nº 240";BM;2005
Ituiutaba;"Casa da Cultura ""Altair Alves Ferreira""";Avenida Três  nº 240;BI;2005
Ituiutaba;Praça Cônego Ângelo - 14,1 ha;Avenida 9 com Ruas Vinte e Vinte e Dois - Centro;CP;2007
Ituiutaba;Pontes sobre o Rio Tijuco - Ponte Raul Soares;Interliga a BR 365;BI;2000
Ituiutaba;Prensa tipográfica móvel da gráfica Cultural Jaci de Almeida: tipos contidos em 30 caixas, guarnições e simbolos contidos em 2 caixas, clichês contidos em 12 caixas, 01 componedor de 33 cm - marca Fhuhn&Sohnhalburg, 01 componedor de 20 cm - marca Temagra, 01 componedor de 26 cm sem marca, 02 bolandeiras de 32x24cm, 01 bolandeira de 53x38 5 cm, rama metálica de dimensão 26x17cm;Fundação Cultural de Ituiutaba - Rua Vinte e Quatro  nº 1342 - Centro;BM;2019
Ituiutaba;Teatro Oduvaldo Viana Filho;Rua Vinte e Quatro  nº 154;BI;2007
Itumirim;Imagem Nossa Senhora Rosário;Capela do Rosário - Distrito de Rosário;BM;2010
Itumirim;Passinho da Paixão;Praça Chicre Záchkia s/nº;BI;2007
Itumirim;Igreja Matriz de São José;Praça Chicre Zákhia s/nº;BI;2007
Itumirim;Estação Ferroviária de Itumirim;Praça da Bandeira s/nº;BI;2003
Itumirim;Capela Nosso Senhor dos Passos;Praça dos Passos  nº  39;BI;2007
Itumirim;Capela Nossa Senhora Aparecida;Praça Nossa Senhora Aparecida s/nº;BI;2007
Itumirim;Escola Municipal Castro Alves;Rua São José  nº 138;BI;2007
Iturama;Primeira Escola Pública - Casa da Memória;Rua São Paulo  nº 352  esquina Avenida Rio Grande;BI;2011
Iturama;Casa de Saúde e Maternidade Santa Rosa;Rua São Paulo  nº 630;BI;2014
Jaboticatubas;Imagem de Santa Efigênia;Igreja Nossa Senhora do Rosário - Praça Coronel Francisco Alves dos Santos,s/nº, Centro;BM;2025
Jaboticatubas;Imagem de São Benedito;Igreja Nossa Senhora do Rosário - Praça Coronel Francisco Alves dos Santos,s/nº, Centro;BM;2025
Jaboticatubas;Imagem de São José de Botas;Acervo da Igreja Nossa Senhora do Rosário - Praça do Rosário s/nº;BM;2007
Jaboticatubas;Igreja Nossa Senhora do Rosário;Praça Coronel Francisco Alves s/nº - Centro;BI;2001
Jaboticatubas;Imagem de Nossa Senhora do Rosário;Igreja Nossa Senhora do Rosário - Praça Coronel Francisco Alves s/nº - Centro;BM;2021
Jaboticatubas;Castanheiras da Praça Padre Messias - 0,31 ha;Compreende a seguinte área: tomando como início, em frente à Igreja Matriz, na Avenida Benedito Valadares, englobando a área da Igreja Matriz, chegando à Rua Padre Pedro Passos, seguindo uma linha reta imaginária até a rua a Rua Teófilo Augusto, seguindo esta última até o encontro com a Rua Santa Luzia e fechando o limite no encontro da Rua Santa Luzia com a Avenida Benedito Valadares, em frente à Igreja Matriz;CP;2001
Jaboticatubas;Conjunto Arquitetônico e Paisagístico da Igreja Nossa Senhora  da Conceição e Praça das Castanheiras - 05  castanheiras - 0,42 ha;Conjunto Arquitetônico e Paisagístico da Igreja de Nossa Senhora da Conceição e Praça das Castanheiras compreende a seguinte área: tomando como início, em frente à Igreja Matriz, na Avenida Benedito Valadares, englobando a área da Igreja Matriz, tendo como limite o Beco da Matriz, chegando à Rua Padre Pedro Passos, indo em direção ao encontro da Rua Santo Antônio com a Rua Teófilo Augusto, seguindo esta última até o encontro com a Rua Santa Luzia e fechando o limite no encontro da Rua Santa Luzia com a Avenida Benedito Valadares, em frente à Igreja Matriz;CP;2007
Jaboticatubas;Parque Nacional Serra do Cipó - 20,764 ha;Rodovia MG - 10  próximo ao KM 94;CP;2001
Jaboticatubas;Conjunto Arquitetura da Fazenda do Cipó: Fazenda, Senzala e Capela   - 0,35 ha;"Area a partir do Rio Cipó, na Fazenda do Cipó, percorrendo os limites de propriedades, curso d’água e vias públicas seguintes: Rio Cipó até o limite da propriedade dos herdeiros de João nogueira Duarte, seguindo limite dessa propriedade com a Fazenda do Campinho até sua confluência com a via de acesso à Fazenda do Cipó; via de acesso à Fazenda do Cipó, em toda sua extensão, atingindo o Rio Cipó.";CP;2001
Jacuí;Casa Sede da Fazenda Cabral;Estrada de Jacuí a Bom Jesus da Penha - área rural;BI;2006
Jacuí;Casa Sede da Fazenda São José;Estrada de Jacuí a Bom Jesus da Penha, Km 01- Zona Suburbana de Jacuí;BI;2006
Jacuí;Casa da Cultura e Cadeia;Praça Presidente Vargas  nº 45;BI;2005
Jacuí;Arquivo: Miscelânea Executivo Municipal 1883 - 1979;Praça Presidente Vargas  nº 45;BM;2007
Jacuí;Residência Senhora Esmeralda Alcântara Assad;Praça Presidente Vargas  nº 71;BI;2005
Jacuí;Prédio do Paço Municipal;Praça Presidente Vargas  nº 72;BI;2007
Jacuí;Escadaria de acesso à antiga usina hidrelétrica;Prolongamento da Rua Duque de Caxias s/nº;BI;2004
Jacuí;Antiga Usina Hidrelétrica;Rua Antônio Marcondes  nº 184;BI;2004
Jacuí;Edificação;Rua Barão do Rio Branco  nº 84;BI;2005
Jacuí;Edificação;Rua Coronel Antônio Cândido  nº 32;BI;2005
Jacuí;Edificação;Rua Governador Valadares  nº 114;BI;2007
Jacuí;Antigo Cine Clube Jacuí;Rua João Pessoa  nº 41;BI;2007
Jacutinga;Estação Ferroviária;Praça Delfim Moreira s/nº;BI;2007
Jacutinga;Poverelo São Francisco de Assis - painel em azulejos;Rua dos Expedicionários s/nº;BM;2008
Jaguaraçu;Imagem de São José;Altar da Matriz situada na Igreja de São José - Rua do Rosário;BM;2018
Janaúba;Bilioteca Pública Municipal Lilia Gonzaga Cavalcanti;Avenida Brasil, nº660 – Centro;BI;2021
Janaúba;Conjunto Paisagístico e Arquitetônico da Praça Doutor Roberto e Capela do Senhor Bom Jesus - Praça Doutor Rocket - 0,69 ha;Região Central, delimitada pelas Ruas Antunino Antunes, Marcolino Evangelista Barbosa, Rua Francisco Sá e sua paralela localizada na porção posterior da Capela do Senhor Bom Jesus - Praça Doutor Rocket;CP;2021
Januária;Casa da Memória do Vale do São Francisco;Praça Artur Bernardes  nº 22;BI;2001
Januária;Calçamento da Rua Cônego Marinho;Rua Cônego Marinho;CP;2001
Januária;Calçamento da Rua Visconde de Ouro Preto;Rua Visconde de Ouro Preto;CP;2001
Japaraíba;Cruzeiro da Antiga Igreja Nossa Senhora do Rosário;Praça do Cemitério - Avenida Olegário Bernardes Amorim;BM;2022
Japaraíba;Imagem de Nossa Senhora do Rosário;Rua José Felipe Melo nº26- acervo particular da Família Fernandes;BM;2011
Jeceaba;Estação Ferroviária de Jeceaba;Praça Sebastião Augusto Dias s/nº;BI;2020
Jeceaba;Imagem do Senhor Morto de Bituri;Capela de Nossa Senhora das Dores;BM;2023
Jenipapo de Minas;Capela da Fazenda do Riacho;Comunidade  Rural do Riacho;BI;2013
Jenipapo de Minas;Fazenda do Riacho;Comunidade  Rural do Riacho;BI;2013
Jenipapo de Minas;Oratório das Irmãs Mendonça;Fazenda Setubal/ Funil - Zona Rural;BM;2011
Jenipapo de Minas;Capela de São Sebastião;Praça Bom Pai s/nº;BI;2013
Jequeri;Mirante Cerca-lá - Serra dos Vieiras - 730 ha;Final da estrada do Bonfim divisa com o município de Santo Antônio do Grama - a 13 km da sede;CP;2007
Jequeri;Coreto da Praça Tenente Mol;Praça Tenente Mol  em frente à Igreja Matriz;BI;2004
Jequeri;Livro: Como Surgiu a Nossa Comunidade-  Álbum de fotos;Rua Padre Benevenuto  nº 07 - pertencente à Escola Estadual Tenente Mol;BM;2005
Jequitinhonha;Conjunto Urbanístico da Avenida Pedro Ferreira e Praça Coronel Franco - 1,3 ha;Avenida Pedro Ferreira, Praça Coronel Franco, Praça Virgem da Lapa, Rua Benedito Valadares, Travessa São Miguel, Rua Isidoro Murta, Rua Inácio Murta, Beco Helio Campolina e Travessa Arnaldo do Povo.;CP;1998
Jequitinhonha;Igreja de Nossa Senhora da Ajuda;Praça Nossa Senhora d'Ajuda s/nº - Povoado de Estiva;BI;2000
Jequitinhonha;Igreja de Nossa Senhora da Boa Viagem;Praça Tancredo Neves nº 88 - Distrito de Guaranilândia;BI;2000
Jequitinhonha;Igreja Matriz de São Miguel e Almas;Praça Virgem da Lapa s/nº;BI;2001
Jequitinhonha;Igreja de Nossa Senhora das Graças;Rua Belo Horizonte  s/nº  esquina com Avenida Brasil;BI;2000
Jequitinhonha;Casa do Senhor Minervino;Rua Benedito Valadares  nº 84;BI;2001
Jequitinhonha;Escola Estadual nuno Melo;Rua Coronel Ramiro Pereira   nº 228;BI;2001
Jequitinhonha;Edificação;Rua Coronel Ramiro Pereira  nº 48;BI;2001
Jequitinhonha;Prefeitura Municipal;Rua Coronel Ramiro Pereira  nº 87;BI;2001
Jequitinhonha;Igreja de São José;Rua Floriano Peixoto s/nº;BI;2001
Jequitinhonha;Capela de Santo Antônio;Rua Turmalina  nº 116;BI;2001
Jequitinhonha;Caixa d'Água;Travessa São Francisco s/nº;BI;2001
Jequitinhonha;Retrato Dona Aurora Martins de Araújo - acervo particular de Maria Amelia Martins;Não informado;BM;2000
Jequitinhonha;"Tapeçaria ""Sonhos e Quimeras"" - acervo particular de Antônio Bernardino G. Murta";Não informado;BM;2000
Joaíma;Casa de Haydea Kangussu Gomes;Praça Coronel Antônia Moreira  nº 330;BI;2000
Joaíma;Posto Aliança;Praça Coronel Antônio Moreira   nº 50;BI;2000
Joaíma;Igreja Nosso Senhor do Bom Jesus;Praça Coronel Antônio Moreira  nº 158;BI;2000
Joaíma;Hotel Cacique de Paulo Resende Costa;Praça Coronel Antônio Moreira  nº 258;BI;2000
Joaíma;Centro Cultural Eduardo Araújo - Antiga Cinema;Praça Mário Martins  nº 158;BI;2000
Joaíma;Cartório do Registro Civil Artur Bernardes Alves Murta;Rua Bernardino Murta  nº 77;BI;2000
Joaíma;Mercearia do Zezinho;Rua João Pinheiro  nº 133;BI;2000
Joaíma;Sobrado do Zezinho;Rua João Pinheiro  nº 140;BI;2000
Joaíma;Mercearia do Senhor Joaquim;Rua Professor Antônio Gomes Moreira  nº 756;BI;2000
Joaíma;Edificação;Rua Theopompo de Almeida  nº 820;BI;2000
Joaíma;Edificação;Rua Tiradentes  nº 40;BI;2000
Joaíma;Edificação;Rua Tiradentes  nº 53;BI;2000
Joaíma;Edificação;Rua Tiradentes  nº 94;BI;2000
Joaíma;Edificação;Travessa Antônio Serafim Costa  nº 18;BI;2000
Joaíma;Antigo Quartel - atual Centro de aprendizagem;Travessa Antônio Serafim Costa  nº 691;BI;2000
Joaíma;Câmara Municipal;Travessa Antônio Serafim Costa  nº31;BI;2000
João Monlevade;Hotel Cassino - área da Arcelor Mittal - Belgo Mineira;Rua do Cassino s/nº;BI;2007
João Monlevade;Igreja São José Operário;Rua Paraúna,nº 641 – Centro Industrial;BI;2024
João Monlevade;Imagem de Santana;Rua Tietê  nº 100 - Escola Estadual Santana;BM;2007
João Monlevade;Conjunto natural e Paisagístico - Centro de Educação Ambiental (CEAM) - 5,51 ha;Estradas internas à RPPN divisa com a BR-262, o antigo campo de aviação , a Usina Belo Mineira e o Bairro Jacuí;CP;2009
João Pinheiro;Réplica da Igrejinha do Sant’Ana do Alegre;Rua Tibúrcio Cardoso de Almeida nº617, Bairro Divinópolis;BI;2025
João Pinheiro;Praça Luiza Mendes Romero - 0,95 ha;Rua Geraldo Rios, Rua Aparício Paiva, Via de acesso ao Mercado e Rua Astolfo Moreira;CP;2019
João Pinheiro;Sobrado Geralda Campos Romero - atual Casa de Cultura;Rua Juca niquinho  nº 220;BI;2015
João Pinheiro;Capela de Nossa Senhora da Conceição;Rua Nilson da Costa Veloso  s/nº - Povoado de Cana Brava;BI;2017
João Pinheiro;Capela do Divino Espírito Santo;Vila do Espirito Santo - Distrito de Olhos D’Agua do Oeste;BI;2018
Joaquim Felício;Acervo de Partituras da antiga Banda Musical de Joaquim Felício;Avenida Getúlio Vargas  nº 135 - Centro;BM;2017
Joaquim Felício;Antiga Prédio da Prefeitura Municipal;Avenida Getúlio Vargas  nº 14 - Centro;BI;2017
Joaquim Felício;Conjunto Arquitetônico e Paisagístico da Estação Ferroviária - 2,3 ha;Rua Terêncio Fernandes s/nº;CP;2008
José Gonçalves de Minas;Fazenda das Gangorras;Estrada secundária que liga José Gonçalves de Minas a Berilo;BI;2007
José Raydan;Quadro do Servo de Deus - Lafayette da Costa Coelho;Residência de Elias Honorato Ramos  estrada do Fonseca s/nº;BM;2013
Juatuba;Imagem de Nossa Senhora de Fátima - acervo de Gilvo Antônio Moreira Dornas;Rua Antônio Dias  nº 405;BM;2008
Juatuba;Estação Ferroviária;Rua João Saliba s/nº;BI;2008
Juiz de Fora;Associação Cultural e Beneficente Ítalo Brasileira Anita Garibaldi;Avenida Barão do Rio Branco  nº 1262;BI;2007
Juiz de Fora;"""Repartições Municipais"" - Paço Municipal - Antiga Câmara Municipal";Avenida Barão do Rio Branco  nº 2234. esquina com a Rua Halfeld;BI;2009
Juiz de Fora;Casa Colucci - Fachadas e volumetria;Avenida Barão do Rio Branco  nº 3263;BI;2007
Juiz de Fora;Centro de Estudos Murilo Mendes - Pró-Reitoria de assuntos comunitários e acervo Murílo Mendes;Avenida Barão do Rio Branco  nº 3372;BI;2007
Juiz de Fora;Antiga Residência Iris Martins Vilela;Avenida Barão do Rio Branco  nº 3512;BI;2007
Juiz de Fora;"""Grupos Centrais"" (volumetria, fachadas e hall de entrada e escada principal)";Avenida Barão do Rio Branco  nº2347;BI;2008
Juiz de Fora;Edifício CIAMPI - volumetria e fachada voltada para Avenida Barão do Rio Branco;Avenida Barão do Rio Branco nº 2153, 2161, 2165;BI;2003
Juiz de Fora;Castelinho SEG - Ultrimagem - volumetria, fachadas e jardins frontais;Avenida Barão do Rio Branco nº 3029;BI;2003
Juiz de Fora;Circulo Militar - volumetria e fachadas laterais e frontal;Avenida Barão do Rio Branco nº 3146;BI;2003
Juiz de Fora;Hospital Santa Lúcia – Cotrel - volumetria e fachada;Avenida Barão do Rio Branco nº 3408;BI;2007
Juiz de Fora;Museu Ferroviário Estação Leopoldina - Volumetria e Fachadas voltadas para a Avenida Brasil e para Avenida Francisco Bernardino;Avenida Brasil  nº 2001 - Fachadas voltadas para a Avenida Brasil e para Avenida Francisco Bernardino - Volumetria;BI;2007
Juiz de Fora;Acervo documental do Fundo Câmara Municipal de Juiz de Fora na 1º República;Avenida Brasil  nº 560;BM;2007
Juiz de Fora;Conjunto Paisagístico das Estações Ferroviárias do Centro de Juiz de Fora-Fachadas e volumetrias dos prédios que formam o conjunto: Estações Leopoldina e Central do Brasil e seus anexos - 8,6388 ha;Avenida Brasil nº 2001;CP;2007
Juiz de Fora;Edificação - volumetria e fachada voltada para a Avenida dos Andradas;Avenida dos Andradas nº 197;BI;2003
Juiz de Fora;Igreja Nossa Senhora da Glória e o marco em granito com as inscrições U.I. 1856, em forma cônica, medindo 50 cm de altura e 30 cm de diâmetro, em sua base localizado no lado luterano do Cemitério da Glória;Avenida dos Andradas nº 855;BI;2007
Juiz de Fora;Edificação Colégio Santos Anjos;Avenida Garibaldi Campinhos  nº 170;BI;2003
Juiz de Fora;Antigas Instalações da Fábrica Bernardo Mascarenhas - Atual Centro Cultural;Avenida Getúlio Vargas  nº 250, Praça Antônio Carlos  nº 41, Rua Paulo Fontin  nº 17 e Rua Paulo Frontin  esquina com a Travessa Doutor Prisco;BI;2007
Juiz de Fora;Edificação - Atual C&A;Avenida Getúlio Vargas  nº 434;BI;2007
Juiz de Fora;Edificação volumetria e fachada voltada para Avenida Getúlio Vargas;Avenida Getúlio Vargas nº 444;BI;2003
Juiz de Fora;Casa d’Itália;Avenida Rio Branco  nº 2585;BI;2007
Juiz de Fora;Fazenda Ribeirão das Rosas;Estrada Ribeirão das Rosas s/nº - Bairro Barbosa Lage;BI;2003
Juiz de Fora;Núcleo Histórico Urbano de Juiz de Fora - 569 unidades;"Formado pelas ruas Santo Antônio, entre Rua Halfeld  Marechal Deodoro; Halfeld entre Rua Gilberto de Alencar e João Pessoa Resende; Marechal Deodoro entre Rua Gilberto Alencar e Francisco Bernardino; Rua Batista de Oliveira entre as Ruas Halfeld e  Marechal Deodoro; Avenida Getúlio Vargas entre as Ruas Espírito Santo e Marechal Deodoro; Rua Paulo de Frontim entre Rua Halfeld e Praça Antônio Carlos; Parque Halfeld ; e Praça Doutor João Penido; Praça Antônio Carlos; Praça João Pessoa";NH;2007
Juiz de Fora;Antigos Bondes;Parque da Lajinha;BM;2008
Juiz de Fora;Estação Ferroviária de Valadares;Povoado de Valadares - Distrito de Rosário de Minas;BI;2009
Juiz de Fora;Conjunto Paisagístico da Praça Antônio Carlos -Fábrica Bernardo Mascarenhas - CIA Industrial e Construtora Pantaleone Arcuri - IInstituto de Educação de J.F.- Escola normal - 8,5985 ha;Praça Antônio Carlos;CP;2007
Juiz de Fora;Marco Comemorativo do Centenário de Juiz de Fora - Monumento Painel do Centenário;Praça da República - Praça da Caveiras;BM;2007
Juiz de Fora;Edificação;Praça Doutor João Penido nº 44;BI;2007
Juiz de Fora;Associação Comercial;Praça Doutor João Penido nº 52-56;BI;2007
Juiz de Fora;"Edificação localizada na esquina da Rua Marechal Deodoro com a Praça Doutor João Penido  composta das seguintes unidades: Praça Doutor João Penido nº 22 que dá acesso ao 2º pavimento onde está instalado o Hotel Renascença;  Lojas térreas nºs 15, 23, 31 e 39 com acesso pela Rua Marechal Deodoro e; Lojas térreas nºs 2, 6, 20, 24, 26 A/B e 38 com acesso à Praça Doutor João Penido - volumetria e Fachada";"Praça Doutor João Penido nºs 2, 6, 20, 22, 24, 26 A-B e 38; Rua Marechal Deodoro nºs 15, 23, 31, 39";BI;2003
Juiz de Fora;Hotel Príncipe - volumetria e fachadas;Praça Doutor João Penido nsº 60, 62, 70 e 74 - esquina com a Rua Halfeld nº 260, 266, 272 e 278;BI;2007
Juiz de Fora;Prédio da Estação RFFSA e passarela anexa;Praça Doutor João Penido s/nº;BI;2007
Juiz de Fora;Conjunto Paisagístico da Praça Doutor João Pessoa, preservadas as fachadas e volumetrias dos imóveis que formam o conjunto: Rua Halfeld 675,  679/ 697, 703/ 711/ 715, Praça João Pessoa s/nº - Cine Teatro Central - Galeria Azarias Vilela e Galeria Ali Halfeld - 0,5527 ha;Praça Doutor João Pessoa;CP;2003
Juiz de Fora;Cinema Central - Antigo Cinetheatro Central - fachadas, pinturas murais e de teto, detalhes decorativos do hall de entrada;Praça João Pessoa - Galeria Azarias Vilela - Galeria Ali Halfed e Rua São João;BI;2007
Juiz de Fora;"Antiga sede da Fazenda da Tapera - Ex-Residência do ""Alcaide-Mor do Fisco e do Mays""";Rua Alencar Tristão nº 236;BI;2009
Juiz de Fora;Edificação volumetria e fachada voltada para a Rua Antônio Dias;Rua Antonio Dias nº 415;BI;2003
Juiz de Fora;Villa Carina;Rua Antônio Dias nº 741;BI;2007
Juiz de Fora;Castelinho dos Bracher - volumetria e fachadas;Rua Antônio Dias Tostes  nº 300;BI;2007
Juiz de Fora;Escola Estadual Duque de Caxias;Rua Barão do Rio Branco  nº 3310;BI;2007
Juiz de Fora;Conjunto Paisagístico do Instituto Granbery -2,1587 ha;Rua Batista de Oliveira  nº 1145;CP;2003
Juiz de Fora;Antiga Delegacia e Cadeia Pública  atual Conservatório Estadual de Música Haidée França Americano: volumetria e fachada voltada para a Rua Batista de Oliveira;Rua Batista de Oliveira nº 377;BI;2003
Juiz de Fora;Casa Guaragil - volumetria e fachada;Rua Batista de Oliveira nº 483;BI;2007
Juiz de Fora;Curtume Krambeck: duas chaminés e parede da fachada revestida de tijolos;Rua Bernardo Mascarenhas  nº 1424 - Bairro Fábrica - Antiga Village da Colônia;BI;2009
Juiz de Fora;Antiga Companhia Mineira de Eletricidade - volumetria e fachada;Rua Bernardo Mascarenhas nº 1215;BI;2007
Juiz de Fora;Capela de Santa Terezinha: volumetria e fachadas;Rua Coronel Miranda s/nº;BI;2007
Juiz de Fora;Antigas instalações da Companhia Industrial e Construtora Pantaleone Arcuri :volumetria e fachadas;Rua Espirito Santo  nº 444,  confluêcia da Praça Antônio Carlos e Avenida Getúlio Vargas;BI;2007
Juiz de Fora;Escola normal - Institudo Estadual de Educação;Rua Espirito Santo s/nº  esquina com Avenida. Getúlio Vargas;BI;2008
Juiz de Fora;Remanescentes das Antigas instalações da Compania Mineira de Eletricidade: volumetria e fachadas - Centrais Elétricas de Minas Gerais;Rua Espírito Santo nº 467 e s/nºª;BI;2008
